"index","city","state","country","report_summary","report_status","report_type","report_magnitude","land_uses","reporter_name","date_of_reform","last_updated","is_verified","is_magnitude_regional","is_magnitude_citywide","is_magnitude_citycenter","is_magnitude_transit","is_magnitude_mainstreet","is_type_eliminated","is_type_reduced","is_type_maximums","is_uses_alluses","is_uses_residential","is_uses_commercial","is_uses_lowdensity","is_uses_multifamily","is_no_mandate_city","population","is_notable","is_recent","citation_url","lat","long","id","magnitude_encoded","border_encoded","land_use_encoded","population_encoded","city_search","is_special"
"380","Belleville","WI","US","Areas which are located in a fire district as designated on the Official Map are exempt from minimum parking requirements.","Implemented","Eliminate Parking Minimums","City Center/Business District","All Uses","Samuel Deetz","","April 28, 2023, 8:52:01 AM PDT",0,0,0,1,0,0,1,0,0,1,0,0,0,0,0,2491,"false","false","https://parkingreform.org/mandates-map/city_detail/Belleville_WI.html",42.8595048,-89.5333388,"BellevilleWIUS","City Center","City Center All","city",0.2,"Belleville, WI","not_special_icon"
"381","Postville","IA","US","No off-street parking is required in the C-1 Central Business District, except for hotels, motels and funeral homes.","Implemented","Eliminate Parking Minimums","City Center/Business District","Commercial, Residential, Other","Samuel Deetz","","April 12, 2023, 1:29:21 PM PDT",0,0,0,1,0,0,1,0,0,0,1,1,0,0,0,2503,"false","false","https://parkingreform.org/mandates-map/city_detail/Postville_IA.html",43.0865887,-91.5684784,"PostvilleIAUS","City Center","City Center","laptop",0.2,"Postville, IA","not_special_icon"
"382","Hayward","WI","US","All permitted, accessory or conditional land uses in the CBD Central Business Overlay District are exempt from minimum parking requirements.","Implemented","Eliminate Parking Minimums","City Center/Business District","Commercial, Residential, Other","Samuel Deetz","","April 26, 2023, 7:20:31 PM PDT",0,0,0,1,0,0,1,0,0,0,1,1,0,0,0,2512,"false","false","https://parkingreform.org/mandates-map/city_detail/Hayward_WI.html",46.0129676,-91.4848728,"HaywardWIUS","City Center","City Center","laptop",0.2,"Hayward, WI","not_special_icon"
"383","Wolf Point","MT","US","C-1 Central Commercial District residential uses with five or less units are not required to provide any off-street parking.","Implemented","Eliminate Parking Minimums","City Center/Business District","Residential","Samuel Deetz","","April 8, 2023, 11:52:12 AM PDT",0,0,0,1,0,0,1,0,0,0,1,0,0,0,0,2517,"false","false","https://parkingreform.org/mandates-map/city_detail/WolfPoint_MT.html",48.090574,-105.640557,"Wolf PointMTUS","City Center","City Center","home",0.2,"Wolf Point, MT","not_special_icon"
"384","Versailles","MO","US","The Central Business District around the Courthouse Square from Church Street on the north, Washington on the south, Van Buren on the east and Burke on the west is exempt from minimum parking requirements.","Implemented","Eliminate Parking Minimums","City Center/Business District","All Uses","Samuel Deetz","","May 2, 2023, 11:13:20 AM PDT",0,0,0,1,0,0,1,0,0,1,0,0,0,0,0,2539,"false","false","https://parkingreform.org/mandates-map/city_detail/Versailles_MO.html",38.4314141,-92.8410274,"VersaillesMOUS","City Center","City Center All","city",0.2,"Versailles, MO","not_special_icon"
"385","Lawson","MO","US","The C-1 Central Business District is exempt from minimum parking requirements.","Implemented","Eliminate Parking Minimums","City Center/Business District","All Uses","Samuel Deetz","","April 19, 2023, 7:40:14 PM PDT",0,0,0,1,0,0,1,0,0,1,0,0,0,0,0,2541,"false","false","https://parkingreform.org/mandates-map/city_detail/Lawson_MO.html",39.4383387,-94.2041096,"LawsonMOUS","City Center","City Center All","city",0.2,"Lawson, MO","not_special_icon"
"386","Sabetha","KS","US","Minimum parking requirements do not apply to the C-1 Downtown Commercial District.","Implemented","Eliminate Parking Minimums","City Center/Business District","All Uses","Samuel Deetz","","April 6, 2023, 2:47:38 PM PDT",0,0,0,1,0,0,1,0,0,1,0,0,0,0,0,2545,"false","false","https://parkingreform.org/mandates-map/city_detail/Sabetha_KS.html",39.9032342,-95.8002347,"SabethaKSUS","City Center","City Center All","city",0.2,"Sabetha, KS","not_special_icon"
"387","Mineral Point","WI","US","The C-1 Central Business District is exempt from minimum parking requirements.","Implemented","Eliminate Parking Minimums","City Center/Business District","All Uses","Samuel Deetz","","April 22, 2023, 10:00:53 AM PDT",0,0,0,1,0,0,1,0,0,1,0,0,0,0,0,2581,"false","false","https://parkingreform.org/mandates-map/city_detail/MineralPoint_WI.html",42.8601834,-90.179547,"Mineral PointWIUS","City Center","City Center All","city",0.2,"Mineral Point, WI","not_special_icon"
"388","Hickman","NE","US","Off-street parking requirements do not apply to uses within the C-1 Commercial Limited District.","Implemented","Eliminate Parking Minimums","City Center/Business District","All Uses","Samuel Deetz","","April 7, 2023, 3:23:38 PM PDT",0,0,0,1,0,0,1,0,0,1,0,0,0,0,0,2607,"false","false","https://parkingreform.org/mandates-map/city_detail/Hickman_NE.html",40.6199714,-96.6323776,"HickmanNEUS","City Center","City Center All","city",0.2,"Hickman, NE","not_special_icon"
"389","Rock Rapids","IA","US","The (C-1) Downtown Commercial District is exempt from minimum parking requirements.","Implemented","Eliminate Parking Minimums","City Center/Business District","All Uses","Samuel Deetz","","March 18, 2023, 7:49:30 PM PDT",0,0,0,1,0,0,1,0,0,1,0,0,0,0,0,2611,"false","false","https://parkingreform.org/mandates-map/city_detail/RockRapids_IA.html",43.4303235,-96.1674831,"Rock RapidsIAUS","City Center","City Center All","city",0.2,"Rock Rapids, IA","not_special_icon"
"390","Burlington","KS","US","No parking is required in the C-1 Central Business District except for dwelling units constructed in conjunction with business uses.","Implemented","Eliminate Parking Minimums","City Center/Business District","Commercial","Samuel Deetz","","April 6, 2023, 9:24:11 PM PDT",0,0,0,1,0,0,1,0,0,0,0,1,0,0,0,2634,"false","false","https://parkingreform.org/mandates-map/city_detail/Burlington_KS.html",38.1944667,-95.7427641,"BurlingtonKSUS","City Center","City Center","building",0.2,"Burlington, KS","not_special_icon"
"391","Butler","IN","US","Off-street parking spaces are not required for business uses in the Butler Historic District.","Implemented","Eliminate Parking Minimums","City Center/Business District","Commercial","Samuel Deetz","","March 30, 2023, 10:13:12 PM PDT",0,0,0,1,0,0,1,0,0,0,0,1,0,0,0,2635,"false","false","https://parkingreform.org/mandates-map/city_detail/Butler_IN.html",41.4297694,-84.8713507,"ButlerINUS","City Center","City Center","building",0.2,"Butler, IN","not_special_icon"
"392","Clearwater","KS","US","The C-1 commercial district is exempt from minimum parking requirements.","Implemented","Eliminate Parking Minimums","City Center/Business District","All Uses","Samuel Deetz","","March 29, 2023, 2:01:48 PM PDT",0,0,0,1,0,0,1,0,0,1,0,0,0,0,0,2653,"false","false","https://parkingreform.org/mandates-map/city_detail/Clearwater_KS.html",37.5027959,-97.5044921,"ClearwaterKSUS","City Center","City Center All","city",0.2,"Clearwater, KS","not_special_icon"
"393","Juneau","WI","US","The B-2 central business district is exempt from minimum parking requirements.","Implemented","Eliminate Parking Minimums","City Center/Business District","All Uses","Samuel Deetz","","March 27, 2023, 5:19:38 PM PDT",1,0,0,1,0,0,1,0,0,1,0,0,0,0,0,2658,"false","false","https://parkingreform.org/mandates-map/city_detail/Juneau_WI.html",43.4055504,-88.7051037,"JuneauWIUS","City Center","City Center All","city",0.2,"Juneau, WI","not_special_icon"
"394","Eldora","IA","US","The C-2 Commercial District is exempt from minimum parking requirements.","Implemented","Eliminate Parking Minimums","City Center/Business District","All Uses","Samuel Deetz","","March 15, 2023, 1:30:47 PM PDT",0,0,0,1,0,0,1,0,0,1,0,0,0,0,0,2663,"false","false","https://parkingreform.org/mandates-map/city_detail/Eldora_IA.html",42.3606883,-93.099609,"EldoraIAUS","City Center","City Center All","city",0.2,"Eldora, IA","not_special_icon"
"395","Bloomfield","IA","US","The C-2 District is exempt from minimum parking requirements.","Implemented","Eliminate Parking Minimums","City Center/Business District","All Uses","Samuel Deetz","","March 14, 2023, 2:27:55 PM PDT",0,0,0,1,0,0,1,0,0,1,0,0,0,0,0,2682,"false","false","https://parkingreform.org/mandates-map/city_detail/Bloomfield_IA.html",40.7510398,-92.4143872,"BloomfieldIAUS","City Center","City Center All","city",0.2,"Bloomfield, IA","not_special_icon"
"396","Cohasset","MN","US","Uses within the Cohasset Industrial Park (CIP) district are exempt from minimum parking requirements.","Implemented","Eliminate Parking Minimums","Main Street/Special","Industrial","Samuel Deetz","","April 3, 2023, 7:29:50 PM PDT",0,0,0,0,0,1,1,0,0,0,0,0,0,0,0,2689,"false","false","https://parkingreform.org/mandates-map/city_detail/Cohasset_MN.html",47.263556,-93.620215,"CohassetMNUS","Main Street","Main Street All","car",0.2,"Cohasset, MN","not_special_icon"
"397","Christopher","IL","US","The B-2 Primary Business District is exempt from minimum parking requirements.","Implemented","Eliminate Parking Minimums","City Center/Business District","All Uses","Samuel Deetz","","March 27, 2023, 5:07:41 PM PDT",1,0,0,1,0,0,1,0,0,1,0,0,0,0,0,2697,"false","false","https://parkingreform.org/mandates-map/city_detail/Christopher_IL.html",37.9725501,-89.053408,"ChristopherILUS","City Center","City Center All","city",0.2,"Christopher, IL","not_special_icon"
"398","Savanna","IL","US","The B-1 Retail Business district is exempt from parking requirements for all uses. ","Implemented","Eliminate Parking Minimums","City Center/Business District","All Uses","Samuel Deetz","Apr 6, 2022","February 13, 2023, 1:46:27 PM PST",1,0,0,1,0,0,1,0,0,1,0,0,0,0,0,2699,"false","false","https://parkingreform.org/mandates-map/city_detail/Savanna_IL.html",42.0944672,-90.1567944,"SavannaILUS","City Center","City Center All","city",0.2,"Savanna, IL","not_special_icon"
"399","Hawarden","IA","US","The “B-2” Commercial District is exempt from minimum parking requirements.","Implemented","Eliminate Parking Minimums","City Center/Business District","All Uses","Samuel Deetz","","April 10, 2023, 8:47:07 PM PDT",0,0,0,1,0,0,1,0,0,1,0,0,0,0,0,2700,"false","false","https://parkingreform.org/mandates-map/city_detail/Hawarden_IA.html",42.9956607,-96.485317,"HawardenIAUS","City Center","City Center All","city",0.2,"Hawarden, IA","not_special_icon"
"400","Foley","MN","US","The “B-1"" Central Business District is exempt from minimum parking requirements.","Implemented","Eliminate Parking Minimums","City Center/Business District","All Uses","Samuel Deetz","","March 21, 2023, 9:35:40 PM PDT",0,0,0,1,0,0,1,0,0,1,0,0,0,0,0,2711,"false","false","https://parkingreform.org/mandates-map/city_detail/Foley_MN.html",45.663512,-93.9137277,"FoleyMNUS","City Center","City Center All","city",0.2,"Foley, MN","not_special_icon"
"401","Hillsboro","KS","US","Minimum parking requirements do not apply in the “C – 1” Commercial District.","Implemented","Eliminate Parking Minimums","City Center/Business District","All Uses","Samuel Deetz","","April 6, 2023, 8:38:43 PM PDT",0,0,0,1,0,0,1,0,0,1,0,0,0,0,0,2732,"false","false","https://parkingreform.org/mandates-map/city_detail/Hillsboro_KS.html",38.3533075,-97.2047316,"HillsboroKSUS","City Center","City Center All","city",0.2,"Hillsboro, KS","not_special_icon"
"402","Granite Falls","MN","US","The C-2 Downtown Commerce District is exempt from minimum parking requirements.","Implemented","Eliminate Parking Minimums","City Center/Business District","All Uses","Samuel Deetz","","March 27, 2023, 6:21:08 PM PDT",0,0,0,1,0,0,1,0,0,1,0,0,0,0,0,2737,"false","false","https://parkingreform.org/mandates-map/city_detail/GraniteFalls_MN.html",44.8099575,-95.5455752,"Granite FallsMNUS","City Center","City Center All","city",0.2,"Granite Falls, MN","not_special_icon"
"403","Roseau","MN","US","All commercial uses are exempt from minimum parking requirements.","Implemented","Eliminate Parking Minimums","Citywide","Commercial","Samuel Deetz","","March 27, 2023, 5:22:43 PM PDT",1,0,1,0,0,0,1,0,0,0,0,1,0,0,0,2744,"false","false","https://parkingreform.org/mandates-map/city_detail/Roseau_MN.html",48.8457996,-95.7613231,"RoseauMNUS","Citywide","Citywide","building",0.2,"Roseau, MN","not_special_icon"
"404","Barnesville","MN","US","The C-1 Central Business District is exempt from off-street parking and loading regulations.","Implemented","Eliminate Parking Minimums","City Center/Business District","All Uses","Samuel Deetz","","April 4, 2023, 10:09:19 AM PDT",0,0,0,1,0,0,1,0,0,1,0,0,0,0,0,2759,"false","false","https://parkingreform.org/mandates-map/city_detail/Barnesville_MN.html",46.652182,-96.41979,"BarnesvilleMNUS","City Center","City Center All","city",0.2,"Barnesville, MN","not_special_icon"
"405","Galena","KS","US","The C-1 Retail Business District is exempt from minimum parking requirements.","Implemented","Eliminate Parking Minimums","City Center/Business District","All Uses","Samuel Deetz","","April 6, 2023, 9:26:40 PM PDT",0,0,0,1,0,0,1,0,0,1,0,0,0,0,0,2761,"false","false","https://parkingreform.org/mandates-map/city_detail/Galena_KS.html",37.0741519,-94.6390414,"GalenaKSUS","City Center","City Center All","city",0.2,"Galena, KS","not_special_icon"
"406","Windsor","MO","US","The ""C-2"" Central Commercial Business District is exempt from minimum parking requirements.","Implemented","Eliminate Parking Minimums","City Center/Business District","All Uses","Samuel Deetz","","May 2, 2023, 11:15:44 AM PDT",0,0,0,1,0,0,1,0,0,1,0,0,0,0,0,2775,"false","false","https://parkingreform.org/mandates-map/city_detail/Windsor_MO.html",38.5322401,-93.5221545,"WindsorMOUS","City Center","City Center All","city",0.2,"Windsor, MO","not_special_icon"
"407","Albany","MN","US","The C-1 Core Commercial District is exempt from minimum parking requirements.","Implemented","Eliminate Parking Minimums","City Center/Business District","All Uses","Samuel Deetz","","April 4, 2023, 3:33:18 PM PDT",0,0,0,1,0,0,1,0,0,1,0,0,0,0,0,2780,"false","false","https://parkingreform.org/mandates-map/city_detail/Albany_MN.html",45.6299647,-94.5700048,"AlbanyMNUS","City Center","City Center All","city",0.2,"Albany, MN","not_special_icon"
"408","Heyworth","IL","US","When the application of the off street parking regulations results in a requirement of not more than three (3) parking spaces for any commercial or business use, those parking spaces are not required. However, where two (2) or more uses are located on a single lot, only one of those uses may be eligible for the exemption. In no instances may the exemption apply to dwelling units.","Implemented","Eliminate Parking Minimums","Citywide","Commercial, Industrial","Samuel Deetz","","April 11, 2023, 4:07:58 PM PDT",0,0,1,0,0,0,1,0,0,0,0,1,0,0,0,2791,"false","false","https://parkingreform.org/mandates-map/city_detail/Heyworth_IL.html",40.313378,-88.9736633,"HeyworthILUS","Citywide","Citywide","building",0.2,"Heyworth, IL","not_special_icon"
"409","Grundy Center","IA","US","There are no off-street parking requirements in the “C-1” Central Commercial District.","Implemented","Eliminate Parking Minimums","City Center/Business District","All Uses","Samuel Deetz","","March 15, 2023, 9:36:40 AM PDT",0,0,0,1,0,0,1,0,0,1,0,0,0,0,0,2796,"false","false","https://parkingreform.org/mandates-map/city_detail/GrundyCenter_IA.html",42.3616501,-92.7685327,"Grundy CenterIAUS","City Center","City Center All","city",0.2,"Grundy Center, IA","not_special_icon"
"410","Cokato","MN","US","Commercial uses within the C-1 Central Business District are exempt from minimum parking requirements.","Implemented","Eliminate Parking Minimums","City Center/Business District","Commercial","Samuel Deetz","","April 4, 2023, 2:00:19 PM PDT",0,0,0,1,0,0,1,0,0,0,0,1,0,0,0,2799,"false","false","https://parkingreform.org/mandates-map/city_detail/Cokato_MN.html",45.075043,-94.1903675,"CokatoMNUS","City Center","City Center","building",0.2,"Cokato, MN","not_special_icon"
"411","Madrid","IA","US","The C-1 Central Commercial District is exempt from minimum parking requirements.","Implemented","Eliminate Parking Minimums","City Center/Business District","All Uses","Samuel Deetz","","April 30, 2023, 10:03:38 AM PDT",0,0,0,1,0,0,1,0,0,1,0,0,0,0,0,2802,"false","false","https://parkingreform.org/mandates-map/city_detail/Madrid_IA.html",41.8766526,-93.8232813,"MadridIAUS","City Center","City Center All","city",0.2,"Madrid, IA","not_special_icon"
"412","Clarion","IA","US","The Central Commercial (C-1) District is exempt from minimum parking requirements.","Implemented","Eliminate Parking Minimums","City Center/Business District","All Uses","Samuel Deetz","","March 20, 2023, 5:01:40 PM PDT",0,0,0,1,0,0,1,0,0,1,0,0,0,0,0,2810,"false","false","https://parkingreform.org/mandates-map/city_detail/Clarion_IA.html",42.7317899,-93.7321871,"ClarionIAUS","City Center","City Center All","city",0.2,"Clarion, IA","not_special_icon"
"413","Montgomery City","MO","US","No off-street parking is required in the B-2 Central Business District.","Implemented","Eliminate Parking Minimums","City Center/Business District","All Uses","Samuel Deetz","","March 18, 2023, 9:49:40 AM PDT",0,0,0,1,0,0,1,0,0,1,0,0,0,0,0,2811,"false","false","https://parkingreform.org/mandates-map/city_detail/MontgomeryCity_MO.html",38.9775406,-91.5048844,"Montgomery CityMOUS","City Center","City Center All","city",0.2,"Montgomery City, MO","not_special_icon"
"414","Davis","OK","US","In the C-3 general commercial district, only employee parking is required.","Implemented","Eliminate Parking Minimums, Reduce Parking Minimums","City Center/Business District","Residential, Commercial","Samuel Deetz","","April 8, 2023, 2:45:26 PM PDT",0,0,0,1,0,0,1,1,0,0,1,1,0,0,0,2823,"false","false","https://parkingreform.org/mandates-map/city_detail/Davis_OK.html",34.5034796,-97.1188924,"DavisOKUS","City Center","City Center","laptop",0.2,"Davis, OK","not_special_icon"
"415","Fairfax","IA","US","No off-street parking is required in the C1 Central Business District Commercial.","Implemented","Eliminate Parking Minimums","City Center/Business District","All Uses","Samuel Deetz","","April 14, 2023, 7:14:35 PM PDT",0,0,0,1,0,0,1,0,0,1,0,0,0,0,0,2828,"false","false","https://parkingreform.org/mandates-map/city_detail/Fairfax_IA.html",41.9194471,-91.7810132,"FairfaxIAUS","City Center","City Center All","city",0.2,"Fairfax, IA","not_special_icon"
"416","Norway","MI","US","Subject to the approval of the zoning board of appeals, all or part of the required off-street parking in all districts may be waived subject to the applicant's election to contribute a predevelopment fee to the city in lieu of the number of spaces waived. The zoning board of appeals may allow for the contribution to the fund only if the applicant can demonstrate that (1) off-site parking will be impossible or constitute an undue hardship, or (2) a contribution to the fund under the particular circumstances of the application will be more beneficial to the city.","Implemented","Reduce Parking Minimums","Citywide","All Uses","Samuel Deetz","","May 4, 2023, 1:00:11 PM PDT",0,0,1,0,0,0,0,1,0,1,0,0,0,0,0,2840,"false","false","https://parkingreform.org/mandates-map/city_detail/Norway_MI.html",45.786902,-87.903736,"NorwayMIUS","Citywide","Citywide All","city",0.2,"Norway, MI","not_special_icon"
"417","Ketchum","ID","US","In the community core and tourist zone, residential units under 750 square feet are exempt from providing any parking. Community housing, restaurants and food service, the first 5,500 sf of retail use, the first 5,500 square feet of assembly use (theaters, conference centers etc.), are exempt from providing any parking in the community core and tourist zone.","Implemented","Eliminate Parking Minimums","City Center/Business District","Low Density (SF) Residential, Commercial","Michael David","","June 28, 2022, 11:23:46 AM PDT",1,0,0,1,0,0,1,0,0,0,1,1,1,0,0,2855,"","","https://parkingreform.org/mandates-map/city_detail/Ketchum_ID.html",43.680741,-114.363662,"KetchumIDUS","City Center","City Center","laptop",0.2,"Ketchum, ID","not_special_icon"
"418","Bedford","PA","US","The C-1 Central Commercial District and properties located in the RLC Residential and Light Commercial District used for nonresidential purposes are exempt from minimum parking requirements.","Implemented","Eliminate Parking Minimums","City Center/Business District","All Uses","Samuel Deetz","","May 2, 2023, 1:34:04 PM PDT",0,0,0,1,0,0,1,0,0,1,0,0,0,0,0,2861,"false","false","https://parkingreform.org/mandates-map/city_detail/Bedford_PA.html",40.0186921,-78.5039069,"BedfordPAUS","City Center","City Center All","city",0.2,"Bedford, PA","not_special_icon"
"419","Rogers City","MI","US","Rogers City has implemented the removal of parking minimum standards for the B-2 district, the downtown area. This is primarily commercial and mixed use with a couple of residential lots.","Implemented","Eliminate Parking Minimums","City Center/Business District","Commercial, Industrial, Residential","Alex Harimoto","","April 11, 2023, 2:18:39 PM PDT",1,0,0,1,0,0,1,0,0,0,1,1,0,0,0,2886,"false","false","https://parkingreform.org/mandates-map/city_detail/RogersCity_MI.html",45.421391,-83.818185,"Rogers CityMIUS","City Center","City Center","laptop",0.2,"Rogers City, MI","not_special_icon"
"420","Clever","MO","US","The ""C-4"" Central Business District is exempt from minimum parking requirements.","Implemented","Eliminate Parking Minimums","City Center/Business District","All Uses","Samuel Deetz","","April 20, 2023, 7:41:44 PM PDT",0,0,0,1,0,0,1,0,0,1,0,0,0,0,0,2918,"false","false","https://parkingreform.org/mandates-map/city_detail/Clever_MO.html",37.0303327,-93.4729712,"CleverMOUS","City Center","City Center All","city",0.2,"Clever, MO","not_special_icon"
"421","Arcola","IL","US","No off-street parking is required in the B-1 General Commercial District.","Implemented","Eliminate Parking Minimums","City Center/Business District","All Uses","Samuel Deetz","","April 3, 2023, 9:26:08 PM PDT",0,0,0,1,0,0,1,0,0,1,0,0,0,0,0,2927,"false","false","https://parkingreform.org/mandates-map/city_detail/Arcola_IL.html",39.684755,-88.3064367,"ArcolaILUS","City Center","City Center All","city",0.2,"Arcola, IL","not_special_icon"
"422","Wisconsin Dells","WI","US","Parking requirements do not apply to the C-2 Downtown Commercial zoning district.  In addition, the number of parking spaces provided in a ground surface parking lot may not exceed the minimum number by more than 20 percent.","Implemented","Eliminate Parking Minimums, Parking Maximums","City Center/Business District","All Uses","Samuel Deetz","","March 22, 2023, 10:31:13 PM PDT",1,0,0,1,0,0,1,0,1,1,0,0,0,0,0,2942,"false","false","https://parkingreform.org/mandates-map/city_detail/WisconsinDells_WI.html",43.6256168,-89.7715646,"Wisconsin DellsWIUS","City Center","City Center All","city",0.2,"Wisconsin Dells, WI","not_special_icon"
"423","Williams Bay","WI","US","Within the Village Center (VC) District, the minimum parking requirements are waived. In all districts, no site plan may be approved for a multifamily or nonresidential use that proposes more than 120% of the development's minimum number of required parking spaces, except as granted through a conditional use permit.","Implemented","Eliminate Parking Minimums, Parking Maximums","City Center/Business District","All Uses","Samuel Deetz","","April 24, 2023, 3:27:07 PM PDT",0,0,0,1,0,0,1,0,1,1,0,0,0,0,0,2953,"false","false","https://parkingreform.org/mandates-map/city_detail/WilliamsBay_WI.html",42.5780721,-88.5409333,"Williams BayWIUS","City Center","City Center All","city",0.2,"Williams Bay, WI","not_special_icon"
"424","Summerset","SD","US","For commercial uses, excluding new and used vehicle sales, maximum parking limits are set at 20% above the minimum requirements.","Implemented","Parking Maximums","Citywide","Commercial","Samuel Deetz","","April 1, 2023, 4:00:20 PM PDT",0,0,1,0,0,0,0,0,1,0,0,1,0,0,0,2972,"false","false","https://parkingreform.org/mandates-map/city_detail/Summerset_SD.html",44.1787783,-103.3341079,"SummersetSDUS","Citywide","Citywide","building",0.2,"Summerset, SD","not_special_icon"
"425","McCall","ID","US","Minimum parking requirements have been eliminated in current and former urban renewal areas. The majority of the area is the Central Business District","Implemented","Eliminate Parking Minimums","City Center/Business District","Commercial, Industrial","Brian Parker","Oct 6, 2022","May 9, 2023, 9:12:55 AM PDT",0,0,0,1,0,0,1,0,0,0,0,1,0,0,0,2991,"false","false","https://parkingreform.org/mandates-map/city_detail/McCall_ID.html",44.911006,-116.0987364,"McCallIDUS","City Center","City Center","building",0.2,"McCall, ID","not_special_icon"
"426","Provincetown","MA","US","In the Town Center Commercial (TCC) non-residential uses are exempt from parking requirements.","Implemented","Eliminate Parking Minimums","City Center/Business District","Commercial","","","May 24, 2022, 3:11:33 PM PDT",1,0,0,1,0,0,1,0,0,0,0,1,0,0,0,2994,"","","https://parkingreform.org/mandates-map/city_detail/Provincetown_MA.html",42.058436,-70.1786375,"ProvincetownMAUS","City Center","City Center","building",0.2,"Provincetown, MA","not_special_icon"
