"index","city","state","country","report_summary","report_status","report_type","report_magnitude","land_uses","reporter_name","date_of_reform","last_updated","is_verified","is_magnitude_regional","is_magnitude_citywide","is_magnitude_citycenter","is_magnitude_transit","is_magnitude_mainstreet","is_type_eliminated","is_type_reduced","is_type_maximums","is_uses_alluses","is_uses_residential","is_uses_commercial","is_uses_lowdensity","is_uses_multifamily","is_no_mandate_city","population","is_notable","is_recent","citation_url","lat","long","id","magnitude_encoded","border_encoded","land_use_encoded","population_encoded","city_search","is_special"
"729","Monett","MO","US","The District ""A"", First Residential (Single-Family) District is exempt from minimum parking requirements.","Implemented","Eliminate Parking Minimums","Main Street/Special","All Uses","Samuel Deetz","","April 20, 2023, 7:23:41 PM PDT",0,0,0,0,0,1,1,0,0,1,0,0,0,0,0,9576,"false","false","https://parkingreform.org/mandates-map/city_detail/Monett_MO.html",36.9289518,-93.9277149,"MonettMOUS","Main Street","Main Street","city",0.2,"Monett, MO","not_special_icon"
"730","Steger","IL","US","The total number of accessory parking spaces provided for one-family, two-family or multiple-family dwellings or hotels shall not exceed the requirement for such use or for any equivalent new use by more than 50 percent or four spaces, whichever number is greater.","Implemented","Parking Maximums","Citywide","Residential","Samuel Deetz","","March 18, 2023, 1:06:45 PM PDT",0,0,1,0,0,0,0,0,1,0,1,0,0,0,0,9584,"false","false","https://parkingreform.org/mandates-map/city_detail/Steger_IL.html",41.4700348,-87.636432,"StegerILUS","Citywide","Citywide","home",0.2,"Steger, IL","not_special_icon"
"731","Parsons","KS","US","No parking is required in the C-2 Central Business District except for dwelling units permitted in conjunction with business uses.","Implemented","Eliminate Parking Minimums","City Center/Business District","Commercial","Samuel Deetz","","April 7, 2023, 2:12:24 PM PDT",0,0,0,1,0,0,1,0,0,0,0,1,0,0,0,9600,"false","false","https://parkingreform.org/mandates-map/city_detail/Parsons_KS.html",37.3407838,-95.2596295,"ParsonsKSUS","City Center","City Center","building",0.2,"Parsons, KS","not_special_icon"
"732","Howell","MI","US","Howell has no required parking for uses in the Central Business District. New residential construction is exempt. ","Implemented","Eliminate Parking Minimums","City Center/Business District","Commercial","Nani Wolf","","August 17, 2022, 12:12:14 PM PDT",1,0,0,1,0,0,1,0,0,0,0,1,0,0,0,9610,"false","false","https://parkingreform.org/mandates-map/city_detail/Howell_MI.html",42.6072552,-83.9293952,"HowellMIUS","City Center","City Center","building",0.2,"Howell, MI","not_special_icon"
"733","Sturgeon Bay","WI","US","In the central business district (C-2) the required off-street parking spaces only apply to property located south of Redwood Street and to all residential and lodging uses (hotels, boardinghouses, etc.). For uses that are required to provide off-street parking spaces, a per space fee may be paid in lieu of providing the parking spaces.","Implemented","Eliminate Parking Minimums","City Center/Business District","Commercial","Samuel Deetz","","March 18, 2023, 5:14:27 PM PDT",0,0,0,1,0,0,1,0,0,0,0,1,0,0,0,9646,"false","false","https://parkingreform.org/mandates-map/city_detail/SturgeonBay_WI.html",44.8341639,-87.377042,"Sturgeon BayWIUS","City Center","City Center","building",0.2,"Sturgeon Bay, WI","not_special_icon"
"734","Bluefield","WV","US","No minimum off-street parking is required in the BC central business district, except for off-street parking which may be required by the board of adjustment as a condition for granting a special exception.","Implemented","Eliminate Parking Minimums","City Center/Business District","All Uses","Samuel Deetz","","April 1, 2023, 3:41:39 PM PDT",0,0,0,1,0,0,1,0,0,1,0,0,0,0,0,9658,"false","false","https://parkingreform.org/mandates-map/city_detail/Bluefield_WV.html",37.2698395,-81.2223195,"BluefieldWVUS","City Center","City Center All","city",0.2,"Bluefield, WV","not_special_icon"
"735","Silver City","NM","US","Buildings in the Silver City Historic District are not required to provide off-street parking. Bicycle parking may substitute for vehicle parking in other districts.","Implemented","Eliminate Parking Minimums, Reduce Parking Minimums","City Center/Business District","All Uses","Samuel Deetz","","April 6, 2023, 8:59:28 PM PDT",0,0,0,1,0,0,1,1,0,1,0,0,0,0,0,9704,"false","false","https://parkingreform.org/mandates-map/city_detail/SilverCity_NM.html",32.7751371,-108.2754371,"Silver CityNMUS","City Center","City Center All","city",0.2,"Silver City, NM","not_special_icon"
"736","Port Townsend","WA","US","All uses located on floors above the ground floor within the C-I, C-II, C-II(H), C-I/MU and C-II/MU zoning districts are exempt from off-street parking and loading requirements. In addition, maximum parking requirements exist citywide.","Implemented","Reduce Parking Minimums, Parking Maximums","City Center/Business District","All Uses","","","April 19, 2023, 7:21:08 PM PDT",0,0,0,1,0,0,0,1,1,1,0,0,0,0,0,9710,"false","false","https://parkingreform.org/mandates-map/city_detail/PortTownsend_WA.html",48.1179702,-122.769544,"Port TownsendWAUS","City Center","City Center All","city",0.2,"Port Townsend, WA","not_special_icon"
"737","Columbia City","IN","US","Properties within the Central Business District Economic Revitalization Area, as established by City Ordinance Number 984, are exempt from minimum parking requirements.","Implemented","Eliminate Parking Minimums","City Center/Business District","All Uses","Samuel Deetz","","March 31, 2023, 1:55:41 PM PDT",0,0,0,1,0,0,1,0,0,1,0,0,0,0,0,9892,"false","false","https://parkingreform.org/mandates-map/city_detail/ColumbiaCity_IN.html",41.156928,-85.4884616,"Columbia CityINUS","City Center","City Center All","city",0.2,"Columbia City, IN","not_special_icon"
"738","Keokuk","IA","US","The C-3 central business district is exempt from minimum parking requirements.","Implemented","Eliminate Parking Minimums","City Center/Business District","All Uses","Samuel Deetz","","March 18, 2023, 7:39:55 PM PDT",0,0,0,1,0,0,1,0,0,1,0,0,0,0,0,9900,"false","false","https://parkingreform.org/mandates-map/city_detail/Keokuk_IA.html",40.3973423,-91.385202,"KeokukIAUS","City Center","City Center All","city",0.2,"Keokuk, IA","not_special_icon"
"739","Sauk Village","IL","US","Commercial uses under 1,000 square feet in gross floor area in the C-1 district are exempt from parking requirements. Uses under 1,000 square feet in gross floor area located within a shopping center configuration (i.e., a strip mall) are not eligible for this exemption and must provide the required parking.","Implemented","Eliminate Parking Minimums","City Center/Business District","Commercial","Samuel Deetz","","March 18, 2023, 12:59:33 PM PDT",0,0,0,1,0,0,1,0,0,0,0,1,0,0,0,9921,"false","false","https://parkingreform.org/mandates-map/city_detail/SaukVillage_IL.html",41.4883685,-87.5675414,"Sauk VillageILUS","City Center","City Center","building",0.2,"Sauk Village, IL","not_special_icon"
"740","Reedsburg","WI","US","The B1 Central Business District is exempt from minimum parking requirements.","Implemented","Eliminate Parking Minimums","City Center/Business District","All Uses","Samuel Deetz","","March 16, 2023, 5:49:39 PM PDT",0,0,0,1,0,0,1,0,0,1,0,0,0,0,0,9984,"false","false","https://parkingreform.org/mandates-map/city_detail/Reedsburg_WI.html",43.5324809,-90.0026259,"ReedsburgWIUS","City Center","City Center All","city",0.2,"Reedsburg, WI","not_special_icon"
"741","Ellisville","MO","US","On-street parking on non-residential portion of side or back streets may count towards minimum parking requirements. Maximum parking requirements exist for all uses.","Implemented","Reduce Parking Minimums, Parking Maximums","Citywide","All Uses","Samuel Deetz","","May 4, 2023, 1:10:57 PM PDT",0,0,1,0,0,0,0,1,1,1,0,0,0,0,0,9985,"false","false","https://parkingreform.org/mandates-map/city_detail/Ellisville_MO.html",38.5946373,-90.584838,"EllisvilleMOUS","Citywide","Citywide All","city",0.2,"Ellisville, MO","not_special_icon"
"742","Highland","IL","US","No off-street parking is required for buildings and uses located within the boundaries of an area enclosed by 12th Street, Walnut Street, 9th Street, and Pine Street provided they are located within 500 feet of a public parking lot.","Implemented","Eliminate Parking Minimums","City Center/Business District","All Uses","Samuel Deetz","","April 3, 2023, 9:19:42 PM PDT",0,0,0,1,0,0,1,0,0,1,0,0,0,0,0,9991,"false","false","https://parkingreform.org/mandates-map/city_detail/Highland_IL.html",38.7394918,-89.6712008,"HighlandILUS","City Center","City Center All","city",0.2,"Highland, IL","not_special_icon"
"743","Cody","WY","US","Properties within the downtown parking district are exempt from providing up to 100 off street parking spaces that would otherwise be required. Uses in the downtown parking district that exceed the 100 space threshold shall provide off street parking in the amount required in excess of 100 spaces.","Implemented","Eliminate Parking Minimums","City Center/Business District","All Uses","Samuel Deetz","","March 20, 2023, 4:44:46 PM PDT",0,0,0,1,0,0,1,0,0,1,0,0,0,0,0,10066,"false","false","https://parkingreform.org/mandates-map/city_detail/Cody_WY.html",44.5263107,-109.056392,"CodyWYUS","City Center","City Center All","city",0.2,"Cody, WY","not_special_icon"
"744","Harrisonville","MO","US","The ""CBD-1"" Downtown Core Business District is exempt from minimum parking requirements.","Implemented","Eliminate Parking Minimums","City Center/Business District","All Uses","Samuel Deetz","","May 2, 2023, 9:54:33 AM PDT",0,0,0,1,0,0,1,0,0,1,0,0,0,0,0,10121,"false","false","https://parkingreform.org/mandates-map/city_detail/Harrisonville_MO.html",38.655124,-94.3471072,"HarrisonvilleMOUS","City Center","City Center All","city",0.2,"Harrisonville, MO","not_special_icon"
"745","Canandaigua","NY","US","There are no provisions that establish a minimum number of off-street parking spaces for development. However, certain development proposals are required to complete a parking demand analysis, which will assist in determining off-street parking spaces required. ","Implemented","Eliminate Parking Minimums","Citywide","All Uses","Eric Cooper","Nov 16, 2020","April 18, 2022, 2:08:13 PM PDT",1,0,1,0,0,0,1,0,0,1,0,0,0,0,1,10156,"","","https://parkingreform.org/mandates-map/city_detail/Canandaigua_NY.html",42.8858579,-77.2799761,"CanandaiguaNYUS","Citywide","Citywide All","city",0.2,"Canandaigua, NY","not_special_icon"
"746","Sparta","WI","US","No off-street parking is required in the B-1 downtown business district, except for dwelling units located above the ground floor existing prior to the update to the ordinance.","Implemented","Eliminate Parking Minimums","City Center/Business District","All Uses","Samuel Deetz","Sep 8, 2022","February 20, 2023, 9:30:28 PM PST",1,0,0,1,0,0,1,0,0,1,0,0,0,0,0,10175,"false","false","https://parkingreform.org/mandates-map/city_detail/Sparta_WI.html",43.9441328,-90.8129118,"SpartaWIUS","City Center","City Center All","city",0.2,"Sparta, WI","not_special_icon"
"747","Fort Madison","IA","US","The total number of parking spaces provided for one-family, two-family or multiple- family dwellings or hotels may not exceed the requirements by more than fifty percent (50%) or four (4) spaces, whichever number is greater.","Implemented","Parking Maximums","Citywide","Residential, Other","Samuel Deetz","","April 13, 2023, 7:09:21 PM PDT",0,0,1,0,0,0,0,0,1,0,1,0,0,0,0,10270,"false","false","https://parkingreform.org/mandates-map/city_detail/FortMadison_IA.html",40.6311415,-91.3084007,"Fort MadisonIAUS","Citywide","Citywide","home",0.2,"Fort Madison, IA","not_special_icon"
"748","Yazoo City","MS","US","Uses located in the central business district are exempt from minimum parking requirements.","Implemented","Eliminate Parking Minimums","City Center/Business District","All Uses","Samuel Deetz","","April 1, 2023, 9:17:33 AM PDT",0,0,0,1,0,0,1,0,0,1,0,0,0,0,0,10316,"false","false","https://parkingreform.org/mandates-map/city_detail/YazooCity_MS.html",32.8550965,-90.4056469,"Yazoo CityMSUS","City Center","City Center All","city",0.2,"Yazoo City, MS","not_special_icon"
"749","Carroll","IA","US","The “B-3” Central Business District is exempt from minimum parking requirements.","Implemented","Eliminate Parking Minimums","City Center/Business District","All Uses","Samuel Deetz","","April 1, 2023, 8:56:01 PM PDT",0,0,0,1,0,0,1,0,0,1,0,0,0,0,0,10321,"false","false","https://parkingreform.org/mandates-map/city_detail/Carroll_IA.html",42.0651109,-94.8666108,"CarrollIAUS","City Center","City Center All","city",0.2,"Carroll, IA","not_special_icon"
"750","Waverly","IA","US","The C-3 commercial district is exempt from minimum parking requirements.","Implemented","Eliminate Parking Minimums","City Center/Business District","All Uses","Samuel Deetz","","April 1, 2023, 8:45:07 PM PDT",0,0,0,1,0,0,1,0,0,1,0,0,0,0,0,10394,"false","false","https://parkingreform.org/mandates-map/city_detail/Waverly_IA.html",42.7258451,-92.4746033,"WaverlyIAUS","City Center","City Center All","city",0.2,"Waverly, IA","not_special_icon"
"751","Smithville","MO","US","No off-street parking or loading space is required for any use located in the ""B-4"" Central Business District.","Implemented","Eliminate Parking Minimums","City Center/Business District","All Uses","Samuel Deetz","","April 19, 2023, 7:49:01 PM PDT",0,0,0,1,0,0,1,0,0,1,0,0,0,0,0,10406,"false","false","https://parkingreform.org/mandates-map/city_detail/Smithville_MO.html",39.3868396,-94.5815937,"SmithvilleMOUS","City Center","City Center All","city",0.2,"Smithville, MO","not_special_icon"
"752","Fountain Inn","SC","US","There are parking maximums for certain land uses (apartment, industrial manufacturing, medical/dental, retail/commercial/office, auditorium, automobile repair facility, automobile service station)","Implemented","Parking Maximums","Citywide","Residential, Other, Industrial, Medical, Commercial, Multi-Family Residential","","","June 21, 2022, 11:12:33 AM PDT",1,0,1,0,0,0,0,0,1,0,1,1,0,1,0,10441,"","","https://parkingreform.org/mandates-map/city_detail/FountainInn_SC.html",34.6912995,-82.19889996,"Fountain InnSCUS","Citywide","Citywide","laptop",0.2,"Fountain Inn, SC","not_special_icon"
"753","Pella","IA","US","Any use within the CBD Central Business District, other than residential, is exempt from the requirement to provide off-street parking.","Implemented","Eliminate Parking Minimums","City Center/Business District","Commercial","Samuel Deetz","","March 20, 2023, 5:26:25 PM PDT",0,0,0,1,0,0,1,0,0,0,0,1,0,0,0,10464,"false","false","https://parkingreform.org/mandates-map/city_detail/Pella_IA.html",41.4073138,-92.9174074,"PellaIAUS","City Center","City Center","building",0.2,"Pella, IA","not_special_icon"
"754","Atchison","KS","US","City allows for on-street spaces to count towards minimums in residential zones and allows for shared off-site parking reductions in other zones.","Implemented","Reduce Parking Minimums","Main Street/Special","Residential","","","May 24, 2022, 3:07:29 PM PDT",1,0,0,0,0,1,0,1,0,0,1,0,0,0,0,10476,"","","https://parkingreform.org/mandates-map/city_detail/Atchison_KS.html",39.5632392,-95.1199452,"AtchisonKSUS","Main Street","Main Street All","home",0.2,"Atchison, KS","not_special_icon"
"755","Taylorville","IL","US","There are no minimum requirements within the nine (9) square block area bordered by Walnut Street on the east, Vine Street on the north, Webster Street on the west and Franklin Street on the south.","Implemented","Eliminate Parking Minimums","City Center/Business District","All Uses","Samuel Deetz","","February 20, 2023, 10:15:54 PM PST",1,0,0,1,0,0,1,0,0,1,0,0,0,0,0,10506,"false","false","https://parkingreform.org/mandates-map/city_detail/Taylorville_IL.html",39.548935,-89.294533,"TaylorvilleILUS","City Center","City Center All","city",0.2,"Taylorville, IL","not_special_icon"
"756","Victoria","MN","US","New developments or significant redevelopments in the central business district (the CBD) may decrease the parking spaces required by up to 50 percent of the requirements, with the exception of residential uses. All residential uses in the central business district are subject to the requirements.","Implemented","Reduce Parking Minimums","City Center/Business District","Commercial","Samuel Deetz","","April 26, 2023, 8:48:52 PM PDT",0,0,0,1,0,0,0,1,0,0,0,1,0,0,0,10546,"false","false","https://parkingreform.org/mandates-map/city_detail/Victoria_MN.html",44.8585738,-93.6616266,"VictoriaMNUS","City Center","City Center","building",0.2,"Victoria, MN","not_special_icon"
"757","Excelsior Springs","MO","US","The Central Business District is exempt from minimum parking requirements.","Implemented","Eliminate Parking Minimums","City Center/Business District","All Uses","Samuel Deetz","","May 2, 2023, 11:18:30 AM PDT",0,0,0,1,0,0,1,0,0,1,0,0,0,0,0,10553,"false","false","https://parkingreform.org/mandates-map/city_detail/ExcelsiorSprings_MO.html",39.3417244,-94.2223507,"Excelsior SpringsMOUS","City Center","City Center All","city",0.2,"Excelsior Springs, MO","not_special_icon"
"758","Le Mars","IA","US","Off-street parking and loading requirements are not required for any use in the “B-3” Central Business District, except residential dwellings, which must provide one parking space per dwelling unit.","Implemented","Eliminate Parking Minimums","City Center/Business District","Commercial","Samuel Deetz","","April 10, 2023, 8:54:46 PM PDT",0,0,0,1,0,0,1,0,0,0,0,1,0,0,0,10571,"false","false","https://parkingreform.org/mandates-map/city_detail/LeMars_IA.html",42.792151,-96.1662993,"Le MarsIAUS","City Center","City Center","building",0.2,"Le Mars, IA","not_special_icon"
"759","Portage","WI","US","Parking space requirements are waived within the B-2 downtown district, except for developments exceeding 40,000 square feet.","Implemented","Eliminate Parking Minimums","City Center/Business District","All Uses","Samuel Deetz","","March 18, 2023, 5:24:21 PM PDT",0,0,0,1,0,0,1,0,0,1,0,0,0,0,0,10581,"false","false","https://parkingreform.org/mandates-map/city_detail/Portage_WI.html",43.539494,-89.461334,"PortageWIUS","City Center","City Center All","city",0.2,"Portage, WI","not_special_icon"
"760","River Grove","IL","US","Businesses containing cultural and religious uses, recreational and entertainment uses, and retail and service uses, which are under one thousand (1,000) square feet in gross floor area in the R4, C1 and C2 districts are exempt from minimum parking requirements. Businesses under one thousand (1,000) square feet in gross floor area located within a shopping center configuration (i.e., a ""strip mall"") are not eligible for this exemption. In the R3, R4, C1 and C2 Districts, on street parking spaces may be counted toward required off street parking spaces. New on street parking spaces may be created to count toward required off street parking. Single-family dwellings may not provide more than four spaces.","Implemented","Eliminate Parking Minimums, Reduce Parking Minimums, Parking Maximums","City Center/Business District","Commercial","Samuel Deetz","Dec 21, 2006","May 5, 2023, 2:28:24 PM PDT",0,0,0,1,0,0,1,1,1,0,0,1,0,0,0,10612,"false","false","https://parkingreform.org/mandates-map/city_detail/RiverGrove_IL.html",41.9258642,-87.8358943,"River GroveILUS","City Center","City Center","building",0.2,"River Grove, IL","not_special_icon"
"761","Maryville","MO","US","No off-street parking is required in the portion of the C-2 General Business District bounded by Fifth, Vine, Second and Buchanan Streets.","Implemented","Eliminate Parking Minimums","City Center/Business District","All Uses","Samuel Deetz","","April 18, 2023, 10:40:11 AM PDT",0,0,0,1,0,0,1,0,0,1,0,0,0,0,0,10633,"false","false","https://parkingreform.org/mandates-map/city_detail/Maryville_MO.html",40.3460468,-94.8723858,"MaryvilleMOUS","City Center","City Center All","city",0.2,"Maryville, MO","not_special_icon"
"762","Monroe","WI","US","Within the CMU District, the parking requirements are waived for non-residential uses. Residential uses must provide evidence of the availability of off-street public or private parking in the amount of one parking space per dwelling unit within 1,000 feet of the unit. In addition, no site plan may be approved for a multifamily or nonresidential use which contains more than 125% of the development's minimum number of required parking spaces.","Implemented","Eliminate Parking Minimums","City Center/Business District","Commercial","Samuel Deetz","","March 18, 2023, 4:16:44 PM PDT",0,0,0,1,0,0,1,0,0,0,0,1,0,0,0,10661,"false","false","https://parkingreform.org/mandates-map/city_detail/Monroe_WI.html",42.6136586,-89.58520522,"MonroeWIUS","City Center","City Center","building",0.2,"Monroe, WI","not_special_icon"
"763","Holmen","WI","US","Parking requirements within the B-1 Downtown Business District are lowered for all uses.","Implemented","Reduce Parking Minimums","City Center/Business District","All Uses","Samuel Deetz","","May 1, 2023, 7:03:14 PM PDT",0,0,0,1,0,0,0,1,0,1,0,0,0,0,0,10661,"false","false","https://parkingreform.org/mandates-map/city_detail/Holmen_WI.html",43.9632962,-91.2562539,"HolmenWIUS","City Center","City Center All","city",0.2,"Holmen, WI","not_special_icon"
"764","Riverdale","IL","US","When the application of the off-street parking provisions results in a requirement of not more than three spaces on a single zoning lot in any business or industrial district, such parking spaces need not be provided; however, where two or more uses are located on a single zoning lot, only one of those uses may be eligible for the exemption. There are no minimum parking requirements for the B-1 community shopping zoning district.","Implemented","Eliminate Parking Minimums","City Center/Business District","All Uses","Samuel Deetz","","May 5, 2023, 2:32:28 PM PDT",0,0,0,1,0,0,1,0,0,1,0,0,0,0,0,10663,"false","false","https://parkingreform.org/mandates-map/city_detail/Riverdale_IL.html",41.6333678,-87.6331021,"RiverdaleILUS","City Center","City Center All","city",0.2,"Riverdale, IL","not_special_icon"
"765","Bolivar","MO","US","Off-street parking is not required in the C-3 Central Business District.","Implemented","Eliminate Parking Minimums","City Center/Business District","All Uses","Samuel Deetz","","April 20, 2023, 7:52:34 PM PDT",0,0,0,1,0,0,1,0,0,1,0,0,0,0,0,10679,"false","false","https://parkingreform.org/mandates-map/city_detail/Bolivar_MO.html",37.6110502,-93.4107968,"BolivarMOUS","City Center","City Center All","city",0.2,"Bolivar, MO","not_special_icon"
"766","Bellefontaine Neighbors","MO","US","Non-residential uses in all zoning districts may not contain more than one hundred and ten percent (110%) of the minimum number of parking spaces required.","Implemented","Parking Maximums","Citywide","Commercial, Industrial, Medical, Other","Samuel Deetz","","April 17, 2023, 12:31:36 PM PDT",0,0,1,0,0,0,0,0,1,0,0,1,0,0,0,10740,"false","false","https://parkingreform.org/mandates-map/city_detail/BellefontaineNeighbors_MO.html",38.7403281,-90.2265001,"Bellefontaine NeighborsMOUS","Citywide","Citywide","building",0.2,"Bellefontaine Neighbors, MO","not_special_icon"
"767","Campton Hills","IL","US","Bike-share facilities with a minimum of 15 bicycles may be substituted for up to four automobile spaces or 5% of the required parking spaces, whichever is less. ","Implemented","Reduce Parking Minimums","Citywide","All Uses","Samuel Deetz","","May 3, 2023, 7:23:11 PM PDT",0,0,1,0,0,0,0,1,0,1,0,0,0,0,0,10885,"false","false","https://parkingreform.org/mandates-map/city_detail/CamptonHills_IL.html",41.9361328,-88.3997579,"Campton HillsILUS","Citywide","Citywide All","city",0.2,"Campton Hills, IL","not_special_icon"
"768","Worth","IL","US","When the application of the off-street parking regulations results in a requirement of not more than three (3) spaces on a single lot in any Business District, such parking spaces need not be provided. However, where two (2) or more uses are located on a single lot, only one of these uses is eligible for the exemption. This exemption does not apply to dwelling units.","Implemented","Eliminate Parking Minimums","City Center/Business District","Commercial","Samuel Deetz","","May 5, 2023, 3:00:04 PM PDT",0,0,0,1,0,0,1,0,0,0,0,1,0,0,0,10970,"false","false","https://parkingreform.org/mandates-map/city_detail/Worth_IL.html",41.6899779,-87.7974139,"WorthILUS","City Center","City Center","building",0.2,"Worth, IL","not_special_icon"
"769","Fox Lake","IL","US","No parking requirements exist in the D Downtown Business District.","Implemented","Eliminate Parking Minimums","City Center/Business District","All Uses","Samuel Deetz","Jun 26, 1989","April 27, 2023, 11:27:55 AM PDT",0,0,0,1,0,0,1,0,0,1,0,0,0,0,0,10978,"false","false","https://parkingreform.org/mandates-map/city_detail/FoxLake_IL.html",42.3966874,-88.1836965,"Fox LakeILUS","City Center","City Center All","city",0.2,"Fox Lake, IL","not_special_icon"
"770","Petal","MS","US","Off-street car parking is not required for any use located in the C-3 central business district.","Implemented","Eliminate Parking Minimums","City Center/Business District","All Uses","Samuel Deetz","","April 1, 2023, 9:56:17 AM PDT",0,0,0,1,0,0,1,0,0,1,0,0,0,0,0,11010,"false","false","https://parkingreform.org/mandates-map/city_detail/Petal_MS.html",31.3465627,-89.2600605,"PetalMSUS","City Center","City Center All","city",0.2,"Petal, MS","not_special_icon"
