"","...1","city","state","country","report_summary","report_status","report_type","report_magnitude","land_uses","reporter_name","is_verified","population","is_notable","is_recent","lat","long","id","magnitude_encoded","land_use_encoded","population_encoded","is_special","mag2"
"57",57,"Calgary","AB","CA","The City of Calgary has removed minimum parking requirements for non-residential uses from the Land Use Bylaw.","Implemented","Eliminate Parking Minimums","Citywide","Commercial, Industrial","Bobby Siemiaszko",1,1335145,NA,NA,51.0460954,-114.065465,"CalgaryABCA","blue","building",1,"not_special_icon","Citywide"
"58",58,"Colorado Springs","CO","US","There are two established parking exempt districts in which there is no additional off-street parking required Downtown/Central business district and Old Colorado City, there is a provisional district with reduced parking requirements that partially connects these two districts.","Implemented","Eliminate Parking Minimums","City Center/Business District, Main Street/Special","All Uses","Cullom Radvillas",1,478221,NA,NA,38.8339578,-104.8253485,"Colorado SpringsCOUS","orange","city",0.7,"not_special_icon","City Center"
"59",59,"Minneapolis","MN","US","Minneapolis's comprehensive plan adopted in December 2018 calls for the elimination of minimum parking requirements citywide.  Minimums were removed in the downtown a few years ago and replaced with maximums. The city recently eliminated parking minimums for <50 unit residential developments near high-frequency transit corridors. An ordinance to implement the comprehensive plan was introduced in March 2021.","Passed","Eliminate Parking Minimums, Parking Maximums","Citywide","All Uses","Matt Steele",1,429606,TRUE,TRUE,44.9772995,-93.2654692,"MinneapolisMNUS","blue","city",0.7,"highlighed_icon","Citywide"
"60",60,"Peoria","IL","US","The city removed parking minimum requirements for commercial developments in 2015. Zoning lots less than 12,000 square feet in land area in the Warehouse District and 7,500 square feet in the other Form Districts have no minimum parking requirements","Implemented","Eliminate Parking Minimums, Parking Maximums","Citywide","Commercial","Maggie Kochman",1,110417,NA,NA,40.6938609,-89.5891008,"PeoriaILUS","blue","building",0.4,"not_special_icon","Citywide"
"61",61,"San Bernardino","CA","US","Parking minimum requirements were reduced for the Transit-Oriented Development Overlay District, and bicycle parking minimums were introduced. The development code noted that as the transit system matures, they are looking to reduce or eliminate parking minimums. A 2017 Accessory Dwelling Unit Ammendment reduced minimum parking requirements for ADUs, and prohibits minimums in certain qualified locations.","Implemented","Reduce Parking Minimums","Transit Oriented","Other, Low Density (SF) Residential, Multi-Family Residential","Maggie Kochman",1,215784,NA,NA,34.1083449,-117.2897652,"San BernardinoCAUS","green","home",0.7,"not_special_icon","Transit Oriented"
"62",62,"Fort Lauderdale","FL","US","There are no parking minimums for the City Center and Arts and Sciences Districts.","Implemented","Eliminate Parking Minimums","City Center/Business District","All Uses","Maggie Kochman",1,182437,NA,NA,26.1223084,-80.1433786,"Fort LauderdaleFLUS","orange","city",0.4,"not_special_icon","City Center"
"63",63,"Miami","FL","US","Minimum requirements are waived for newly constructed buildings downtown.  Certain small developments outside downtown are also exempt. Developers of new buildings near transit corridors under 10,000 sq ft can also be exempt. Large buildings near transit corridors can pay fees for exemptions.","Passed","Reduce Parking Minimums, Eliminate Parking Minimums","City Center/Business District, Transit Oriented","Commercial","Maggie Kochman",1,467963,NA,NA,25.7741728,-80.19362,"MiamiFLUS","orange","building",0.7,"not_special_icon","City Center"
"64",64,"Dover","NH","US","There are no statutory parking requirements in Dover, NH. There are parking maximums for all uses and required off-site parking is determined on a per-case basis as part of the application process.","Implemented","Parking Maximums","Citywide","All Uses","Christopher Parker",1,32191,NA,NA,43.198057,-70.8739158,"DoverNHUS","blue","city",0.2,"not_special_icon","Citywide"
"65",65,"Mason City","IA","US","Retail and Office developments have maximum parking entitlements and no minimum parking requirements.","Implemented","Eliminate Parking Minimums, Parking Maximums","Citywide","Commercial","Zane Jacobson",1,26931,NA,NA,43.1535728,-93.2010367,"Mason CityIAUS","blue","building",0.2,"not_special_icon","Citywide"
"66",66,"Anchorage","AK","US","No parking is required in the downtown business districts.","Implemented","Eliminate Parking Minimums","City Center/Business District","All Uses","Bobby Siemiaszko",1,288000,NA,NA,61.2163129,-149.894852,"AnchorageAKUS","orange","city",0.7,"not_special_icon","City Center"
"67",67,"Hot Springs","AR","US","No minimum off street parking required in the business district/Downtown.","Implemented","Eliminate Parking Minimums","City Center/Business District","Commercial, Other","Bobby Siemiaszko",1,38797,NA,NA,34.5038393,-93.0552437,"Hot SpringsARUS","orange","building",0.2,"not_special_icon","City Center"
"68",68,"Phoenix","AZ","US","No car parking is required for non-residential uses in the Downtown and Warehouse districts. Reductions for residential and commercial parking requirements are automatic near light rail stations. Parking maximums are in place for most uses, but there are ample opportunities to increase them.","Implemented","Eliminate Parking Minimums, Reduce Parking Minimums","City Center/Business District, Transit Oriented","Commercial, Residential","Sean Sweat",1,1680992,NA,NA,33.4484367,-112.0741417,"PhoenixAZUS","orange","laptop",1,"not_special_icon","City Center"
"69",69,"Healdsburg","CA","US","Downtown Healdsburg has no parking requirements for non-residential uses for developments less than 15,000 square feet.","Implemented","Eliminate Parking Minimums","City Center/Business District","Commercial","Tony Jordan",1,11845,NA,NA,38.603921,-122.880435681644,"HealdsburgCAUS","orange","building",0.2,"not_special_icon","City Center"
"70",70,"Halifax","NS","CA","Halifax removed all parking minima in the Downtown Plan Area in 2009.","Implemented","Eliminate Parking Minimums","City Center/Business District","All Uses",NA,1,431479,NA,NA,44.648618,-63.5859487,"HalifaxNSCA","orange","city",0.7,"not_special_icon","City Center"
"71",71,"Penetanguishene","ON","CA","In the Urban Core Zone, no parking is required for retail/office/or light manufacturing.","Implemented","Eliminate Parking Minimums","City Center/Business District","Commercial, Other","Maggie Kochman",1,8962,NA,NA,44.7688035,-79.9339487,"PenetanguisheneONCA","orange","building",0.2,"not_special_icon","City Center"
"72",72,"Fremont","CA","US","The Warm Springs/South Fremont Community Plan, adopted in July 2015, eliminates minimum parking requirements within the community plan area. The plan area is centered on the new Warm Springs/South Fremont BART Station.","Implemented","Eliminate Parking Minimums, Parking Maximums","Transit Oriented","All Uses","Tom Radulovich",1,241110,NA,NA,37.5482697,-121.988571,"FremontCAUS","green","city",0.7,"not_special_icon","Transit Oriented"
"73",73,"Panama City","FL","US","Panama City removed all parking minimum requirements on lots less than 10,000sqft, buildings built before 1945, and all new construction less than 5 stories.","Implemented","Eliminate Parking Minimums","City Center/Business District","Commercial, Other","Eric Pate",1,34667,NA,NA,30.1600827,-85.6545729,"Panama CityFLUS","orange","building",0.2,"not_special_icon","City Center"
"74",74,"Honolulu","HI","US","Honolulu County removed parking minimums for all uses in two of the most urbanized planning regions on Oahu, including Honolulu, and also removed parking minimums for all uses in TOD zones.","Implemented","Eliminate Parking Minimums","City Center/Business District, Transit Oriented","Commercial","Tim Streitz",1,345064,NA,NA,21.304547,-157.855676,"HonoluluHIUS","orange","building",0.7,"not_special_icon","City Center"
"75",75,"Jacksonville","FL","US","There are no parking minimums anywhere in the Downtown overlay district.","Implemented","Eliminate Parking Minimums","City Center/Business District","All Uses","Kevin O'Halloran",1,911507,NA,NA,30.3321838,-81.655651,"JacksonvilleFLUS","orange","city",1,"not_special_icon","City Center"
"76",76,"Mountain View","CA","US","The North Bayshore Precise Plan has eliminated minimum parking requirements for an office park district where Google, LinkedIn, and Intuit have their headquarters. A parking maximum of 2.7 spaces per 1,000 square feet of office/R&D was established. All new development must meet at 45% drive-alone rate cap, and there is an overall trip cap for the entire plan area.","Implemented","Eliminate Parking Minimums, Parking Maximums","Main Street/Special","Commercial, Residential, All Uses","Jeffrey Tumlin",1,82739,NA,NA,37.3893889,-122.0832101,"Mountain ViewCAUS","purple","city",0.2,"not_special_icon","Main Street"
"77",77,"Fayetteville","AR","US","Fayetteville, Arkansas has no minimum requirements for residential uses.  They also have several reductions for residential uses as well as parking maximums.","Implemented","Reduce Parking Minimums, Eliminate Parking Minimums, Parking Maximums","Citywide","Commercial, Residential","Bobby Siemiaszko",1,87590,NA,NA,36.0625843,-94.1574328,"FayettevilleARUS","blue","laptop",0.2,"not_special_icon","Citywide"
"78",78,"Los Angeles","CA","US","The Cornfield Arroyo Specific Plan, passed in 2012, has no minimum parking requirements for projects in the area.","Implemented","Eliminate Parking Minimums","Main Street/Special","All Uses","Jonathan Raspa",1,3979576,NA,NA,34.0536909,-118.242766,"Los AngelesCAUS","purple","city",1,"not_special_icon","Main Street"
"79",79,"Norwich","CT","US","Chelsea Central District does not have parking minimums and all retail/shopping centers have parking maximums.","Implemented","Eliminate Parking Minimums, Parking Maximums","City Center/Business District","Commercial","Jason Vincent",1,38768,NA,NA,41.5499565,-72.0891900460276,"NorwichCTUS","orange","building",0.2,"not_special_icon","City Center"
"80",80,"Wilmington","NC","US","Wilmington, North Carolina eliminated parking requirements for central business districts and historic districts.","Implemented","Eliminate Parking Minimums","City Center/Business District, Main Street/Special","All Uses","David Curtis",1,123744,NA,NA,34.2257282,-77.9447107,"WilmingtonNCUS","orange","city",0.4,"not_special_icon","City Center"
"81",81,"Oakland","CA","US","Oakland has no required parking in CBD, S-2, and D-LM zones.  There are parking maximums in those zones.","Implemented","Eliminate Parking Minimums, Parking Maximums","City Center/Business District, Transit Oriented","All Uses","Tom Radulovich",1,433031,NA,NA,37.8044557,-122.2713563,"OaklandCAUS","orange","city",0.7,"not_special_icon","City Center"
"82",82,"Long Beach","CA","US","Long Beach, California has reduced parking minimums for transit-oriented off street parking for residential and hospital use reducing parking from 25 to 50%.","Implemented","Reduce Parking Minimums","Transit Oriented","Residential, Medical","Bobby Siemiaszko",1,462628,NA,NA,33.7690164,-118.191604,"Long BeachCAUS","green","home",0.7,"not_special_icon","Transit Oriented"
"83",83,"New Haven","CT","US","New Haven Parking Authority has signed on to support DesegregateCT's platform, which includes eliminating parking requirements.","Proposed","Eliminate Parking Minimums, Reduce Parking Minimums, Parking Maximums","Citywide","All Uses","Bobby Siemiaszko",1,130250,NA,NA,41.29843435,-72.9310234270791,"New HavenCTUS","blue","city",0.4,"not_special_icon","Citywide"
"84",84,"Fernandina Beach","FL","US","The Central Business District (C-3), lots containing industrial waterfront (I-W) or waterfront mixed use (W-1) are exempt from parking minimums.","Implemented","Eliminate Parking Minimums","City Center/Business District, Main Street/Special","All Uses","Maggie Kochman",1,13169,NA,NA,30.6696818,-81.4625919,"Fernandina BeachFLUS","orange","city",0.2,"not_special_icon","City Center"
"85",85,"Atlanta","GA","US","The city has proposed parking requirement reductions with a focus on transit oriented development.","Proposed","Reduce Parking Minimums","Citywide","All Uses","Maggie Kochman",0,506811,NA,NA,33.7489924,-84.3902644,"AtlantaGAUS","blue","city",1,"not_special_icon","Citywide"
"86",86,"Burlington","VT","US","Burlington Vermont has reduced parking minimums for all parts of the downtown district and shared used districts.  Parking maximums can also not be over 125% of parking minimums in these districts.","Implemented","Reduce Parking Minimums, Parking Maximums","City Center/Business District","All Uses","Bobby Siemiaszko",1,42819,NA,NA,44.4761601,-73.212906,"BurlingtonVTUS","orange","city",0.2,"not_special_icon","City Center"
"87",87,"Chattanooga","TN","US","Chattanooga, TN has no parking requirements in the  Downtown Core.","Implemented","Eliminate Parking Minimums","City Center/Business District","All Uses","Jonathan Hunter",1,182799,NA,NA,35.0457219,-85.3094883,"ChattanoogaTNUS","orange","city",0.4,"not_special_icon","City Center"
"88",88,"Woonsocket","RI","US","Woonsocket, RI does not require parking for non-residential uses in the Urban Commercial and Mixed Use districts.","Implemented","Eliminate Parking Minimums","City Center/Business District","Commercial","Keith Brynes",1,41751,NA,NA,42.0028761,-71.5147839,"WoonsocketRIUS","orange","building",0.2,"not_special_icon","City Center"
"89",89,"Ithaca","NY","US","Ithaca New York does not require any parking for the Central Business District downtown, the West End, Cherry Street District, Newman District, Market District or Mixed Use Districts.","Implemented","Eliminate Parking Minimums","City Center/Business District, Transit Oriented, Main Street/Special","Commercial","Daniel Keough",1,30837,NA,NA,42.4396039,-76.4968019,"IthacaNYUS","orange","building",0.2,"not_special_icon","City Center"
"90",90,"Akron","OH","US","Akron Ohio has no minimum requirements for parking for residential or commercial parking downtown.  Maximum allowed is one space per residence.","Implemented","Parking Maximums, Eliminate Parking Minimums","City Center/Business District","All Uses","Jason Segedy",1,197597,NA,NA,41.083064,-81.518485,"AkronOHUS","orange","city",0.4,"not_special_icon","City Center"
"91",91,"Columbus","OH","US","Columbus has eliminated all parking minimums and requirements in the Downtown planning area. In much of the downtown new accessory surface lots are prohibited.","Implemented","Eliminate Parking Minimums","City Center/Business District","All Uses","Josh Lapp",1,898553,NA,NA,39.9622601,-83.0007065,"ColumbusOHUS","orange","city",1,"not_special_icon","City Center"
"92",92,"Sandpoint","ID","US","Parking requirements are eliminated in the downtown core. Parking minimums are reduced by 20% for developments with affordable housing.","Implemented","Reduce Parking Minimums, Eliminate Parking Minimums","Citywide, City Center/Business District","Residential, All Uses","Steve Lockwood",1,8931,NA,NA,48.2765903,-116.5532476,"SandpointIDUS","blue","city",0.2,"not_special_icon","Citywide"
"93",93,"Indianapolis","IN","US",NA,"Unverified",NA,NA,NA,NA,0,876384,NA,NA,39.7683331,-86.1583502,"IndianapolisINUS","red","car",1,"not_special_icon",NA
"94",94,"Eugene","OR","US","Eugene has eliminated parking minimums in the downtown and university districts. Parking requirements are reduced in various overlay districts.The maximum number of parking spaces for non-residential uses may not exceed 125 percent of the minimum spaces.","Implemented","Parking Maximums, Eliminate Parking Minimums, Reduce Parking Minimums","City Center/Business District","All Uses","Will Dowdy",1,172622,NA,NA,44.0505054,-123.0950506,"EugeneORUS","orange","city",0.4,"not_special_icon","City Center"
"95",95,"Lower Macungie Township","PA","US",NA,"Unverified",NA,NA,NA,"Maggie Kochman",1,32626,NA,NA,40.5283605,-75.5950784269581,"Lower Macungie TownshipPAUS","red","car",0.2,"not_special_icon",NA
"96",96,"Tulsa","OK","US","Tulsa Oklahoma has no parking minimums downtown for all uses.  In the CH District and MX District and surrounding areas downtown, parking minimums are reduced 50% compared to other districts.  Retail uses requiring more than two hundred twenty-five (225) parking spaces may not provide more than four (4) outdoor parking spaces per one thousand (1,000) square feet of floor area.","Implemented","Eliminate Parking Minimums, Reduce Parking Minimums, Parking Maximums","City Center/Business District, Main Street/Special","All Uses","Stephen Lassiter",1,401190,NA,NA,36.1556805,-95.9929113,"TulsaOKUS","orange","city",0.7,"not_special_icon","City Center"
"97",97,"Lancaster","PA","US","Lancaster PA has no minimum requirements for parking in the Central Business District and the surrounding Central Business 1 District.","Implemented","Eliminate Parking Minimums","City Center/Business District","All Uses","Brian Ludicke",1,59265,NA,NA,40.03813,-76.3056686,"LancasterPAUS","orange","city",0.2,"not_special_icon","City Center"
"98",98,"Phoenixville","PA","US","Phoenixville PA had the zoning ordinance rewritten to remove parking requirements for specific blocks of the downtown, and all other parking is required to be based on a parking demand analysis, not specific standards.","Implemented","Eliminate Parking Minimums, Reduce Parking Minimums","City Center/Business District, Citywide","All Uses","Ray Ott",1,16968,NA,NA,40.1303822,-75.5149128,"PhoenixvillePAUS","blue","city",0.2,"not_special_icon","Citywide"
"99",99,"College Station","TX","US","In August 2017 the city authorized the creation of ""Alternative Parking Plans"" but they are all by discretion of the city planner.","Unverified","Reduce Parking Minimums","Citywide","All Uses","Bobby Siemiaszko",1,117911,NA,NA,30.5955289,-96.3071042,"College StationTXUS","blue","city",0.4,"not_special_icon","Citywide"
"100",100,"Colville","WA","US","Colville, Washington is a small town of less than 5,000 people.  Parking minimums are not required in the downtown area as street parking is provided via a fund developers pay into.","Implemented","Eliminate Parking Minimums","City Center/Business District","All Uses","RJ Keetch",1,4832,NA,NA,48.5465695,-117.905537,"ColvilleWAUS","orange","city",0.2,"not_special_icon","City Center"
"101",101,"Yakima","WA","US","Yakima Washington has no parking minimums for all uses in the downtown business district.","Implemented","Eliminate Parking Minimums","City Center/Business District","All Uses","Joshua Hicks",1,93637,NA,NA,46.601557,-120.5108421,"YakimaWAUS","orange","city",0.2,"not_special_icon","City Center"
"102",102,"Colton","CA","US","Colton California has reduced parking minimums for commercial and residential in the downtown and mixed used neighborhoods but has not completely eliminated minimum parking in any area.  Everything is broken down into areas with a chart below it.","Implemented","Reduce Parking Minimums","City Center/Business District, Transit Oriented","All Uses","Bobby Siemiaszko",1,54824,NA,NA,34.0739016,-117.3136547,"ColtonCAUS","orange","city",0.2,"not_special_icon","City Center"
"103",103,"Bismarck","ND","US","Off-street parking is not required for properties within the Downtown Parking District in Bismark.","Implemented","Eliminate Parking Minimums","City Center/Business District","All Uses","Kate Herzog",1,73529,NA,NA,46.808327,-100.783739,"BismarckNDUS","orange","city",0.2,"not_special_icon","City Center"
"104",104,"Billings","MT","US","There are no minimum parking requirements in the Central Business District or the East Billings Parking Overlay within city limits (Code Sec. 6-1203(g)).","Implemented","Eliminate Parking Minimums","City Center/Business District, Main Street/Special","All Uses","Randy Vinson",1,109577,NA,NA,45.7874957,-108.49607,"BillingsMTUS","orange","city",0.4,"not_special_icon","City Center"
"105",105,"Brainerd","MN","US","Brainerd has no off street parking requirements for the following zones: B-4 (General Business) District, B-5 (Commercial Amusement) District, B-6 (Washington Street Commercial) District, I-1 (Light Industry) District, I-2 (General Industry) District. Also, there are exemptions for further reduced parking 515-22-9: Parking Deferment.","Implemented","Eliminate Parking Minimums","City Center/Business District, Main Street/Special","All Uses","Mark Ostgarden",1,13434,NA,NA,46.3580221,-94.2008288,"BrainerdMNUS","orange","city",0.2,"not_special_icon","City Center"
"106",106,"Berrien Springs","MI","US","Berrien Springs has no off street parking requirements in the central business district. There are no set minimums along the M-139 Corridor for non-residential uses, but developers must demonstrate adequate parking supply.","Implemented","Eliminate Parking Minimums","City Center/Business District, Main Street/Special","All Uses","Andrew von Mauer",1,1727,NA,NA,41.9464336,-86.3388965,"Berrien SpringsMIUS","orange","city",0.2,"not_special_icon","City Center"
"107",107,"Albuquerque","NM","US","Albuquerque New Mexico has eliminated off street parking requirements in the downtown and SU-1 Transit Oriented Development.  They have also reduced parking minimums in many other areas and had on street parking account for off street parking by different reduction rates in areas like transit oriented developments.","Implemented","Eliminate Parking Minimums, Reduce Parking Minimums","Citywide, City Center/Business District, Transit Oriented","All Uses","Carrie Barkhurst",1,560513,NA,NA,35.0841034,-106.650985,"AlbuquerqueNMUS","blue","city",1,"not_special_icon","Citywide"
"108",108,"Berkeley","CA","US","Berkeley has no parking requirements for new residential developments of any size, except for new developments on certain  narrow streets in the hills. The city has parking maximums for new residential uses.","Implemented","Eliminate Parking Minimums, Parking Maximums","Citywide","Residential","Tom Radulovich",1,121363,TRUE,TRUE,37.8708393,-122.272863,"BerkeleyCAUS","blue","home",0.4,"highlighed_icon","Citywide"
"109",109,"Madison","WI","US","There is no parking required in the Central District of Madison and in several other mixed-use districts. Some other districts waive parking requirements for new developments smaller than 10,000 square feet.","Implemented","Eliminate Parking Minimums","City Center/Business District","Commercial, Residential","Zane Jacobson",1,259680,NA,NA,43.074761,-89.3837613,"MadisonWIUS","orange","laptop",0.7,"not_special_icon","City Center"
"110",110,"Oakville","ON","CA","Oakville, Ontario has no minimum parkings in the downtown and reduced minimums in some reduction in parking in mixed used zones.","Implemented","Eliminate Parking Minimums, Reduce Parking Minimums","City Center/Business District","All Uses","Joe Nether",1,211382,NA,NA,43.447436,-79.666672,"OakvilleONCA","orange","city",0.7,"not_special_icon","City Center"
"111",111,"Framingham","MA","US","Parking requirements in Framingham were reduced in the Central Business District and ground floor commercial uses in the district are exempt from parking requirements.","Implemented","Reduce Parking Minimums","City Center/Business District, Transit Oriented","All Uses, Commercial, Residential","Sam Scoppettone",1,74416,NA,NA,42.3095704,-71.4413097,"FraminghamMAUS","orange","city",0.2,"not_special_icon","City Center"
"112",112,"Watertown","WI","US","The City of Watertown has no parking requirements for the Central Business (CB) Zoning District.","Implemented","Eliminate Parking Minimums","City Center/Business District, Main Street/Special","All Uses","Jacob Mass",1,23479,NA,NA,43.1948481,-88.7286352,"WatertownWIUS","orange","city",0.2,"not_special_icon","City Center"
"113",113,"West Palm Beach","FL","US",NA,"Implemented","Eliminate Parking Minimums, Reduce Parking Minimums","City Center/Business District","All Uses","Jesse Bailey",1,111955,NA,NA,26.715364,-80.0532942,"West Palm BeachFLUS","orange","city",0.4,"not_special_icon","City Center"
"114",114,"San Diego","CA","US","Residential developments within 1/2 mile of a current or planned major transit stop are exempt from minimum parking requirements. Any provided parking in market-rate developments with more than 4 units must be rented or leased separately (unbundled) from the dwelling unit.","Implemented","Eliminate Parking Minimums","Transit Oriented","Residential","Tony Jordan",0,1423851,NA,NA,32.7174202,-117.1627728,"San DiegoCAUS","green","home",1,"not_special_icon","Transit Oriented"
"115",115,"Washington DC","DC","US","Washington, DC has reduced parking requirements near transit. Parking requirements are eliminated in various zone overlays (D-Zones in downtown)","Implemented","Reduce Parking Minimums, Eliminate Parking Minimums","Citywide, City Center/Business District","All Uses","Ryan Westrom",1,705749,NA,NA,38.918957,-77.0257515619725,"Washington DCDCUS","blue","city",1,"not_special_icon","Citywide"
"116",116,"Jersey City","NJ","US","Jersey City has about a dozen planning districts (known as Redevelopment Plans) with no parking minimums, largely concentrated near PATH rapid transit and HBLR light rail stations. In fact, several of these districts have parking maximums. Examples include the Journal Square 2060, Colgate, Harsimus Cove Station, Grand Jersey, and Newark Ave Downtown plans.","Implemented","Eliminate Parking Minimums, Parking Maximums","Transit Oriented, City Center/Business District, Main Street/Special","All Uses","Ed Gomez",1,262075,NA,NA,40.7215682,-74.047455,"Jersey CityNJUS","orange","city",0.7,"not_special_icon","City Center"
