"","city","state","country","report_summary","report_status","report_type","report_magnitude","land_uses","reporter_name","date_of_reform","last_updated","is_verified","is_magnitude_regional","is_magnitude_citywide","is_magnitude_citycenter","is_magnitude_transit","is_magnitude_mainstreet","is_type_eliminated","is_type_reduced","is_type_maximums","is_uses_alluses","is_uses_residential","is_uses_commercial","is_uses_lowdensity","is_uses_multifamily","is_no_mandate_city","population","is_notable","is_recent","citation_url","lat","long","id","magnitude_encoded","border_encoded","land_use_encoded","population_encoded","city_search","is_special"
"809","Burlington","VT","US","Burlington, VT has eliminated parking mandates citywide and has maximums for many uses. ","Passed","Parking Maximums, Eliminate Parking Minimums","Citywide","All Uses","Edward Erfurt","Jan 9, 2023","January 22, 2023 at 3:25:05 PM PST",0,0,1,0,0,0,1,0,1,1,0,0,0,0,1,42819,"","","https://parkingreform.org/mandates-map/city_detail/Burlington_VT.html",44.4761601,-73.212906,"BurlingtonVTUS","Citywide","Citywide All","city",0.2,"Burlington, VT","not_special_icon"
"810","Trelleborg","Scania","SE","Trelleborg eliminated parking requirements fro new residential development in the city center.","Implemented","Eliminate Parking Minimums","City Center/Business District","Residential","Johan Kerttu","","June 30, 2022 at 11:58:29 AM PDT",1,0,0,1,0,0,1,0,0,0,1,0,0,0,0,43359,"false","false","https://parkingreform.org/mandates-map/city_detail/Trelleborg_Scania.html",55.37592,13.1461522,"TrelleborgScaniaSE","City Center","City Center","home",0.2,"Trelleborg, Scania","not_special_icon"
"811","Shakopee","MN","US","The Central Business (B-3) Zone is exempt from off-street parking requirements.","Implemented","Eliminate Parking Minimums","City Center/Business District","All Uses","Samuel Deetz","","March 27, 2023 at 6:36:40 PM PDT",0,0,0,1,0,0,1,0,0,1,0,0,0,0,0,43698,"false","false","https://parkingreform.org/mandates-map/city_detail/Shakopee_MN.html",44.7980186,-93.5268986,"ShakopeeMNUS","City Center","City Center All","city",0.2,"Shakopee, MN","not_special_icon"
"812","York","PA","US","There are no parking requirements in the Central Business District.","Implemented","Eliminate Parking Minimums","City Center/Business District","All Uses","Skyler Yost","","June 24, 2022 at 12:39:33 PM PDT",1,0,0,1,0,0,1,0,0,1,0,0,0,0,0,43932,"false","false","https://parkingreform.org/mandates-map/city_detail/York_PA.html",39.9624624,-76.727707,"YorkPAUS","City Center","City Center All","city",0.2,"York, PA","not_special_icon"
"813","Wilkes-Barre","PA","US","Any property located in a C-3 Zone (Central Business District) is exempt from providing off-street parking.","Implemented","Eliminate Parking Minimums","City Center/Business District","All Uses","Samuel Deetz","","April 8, 2023 at 11:54:32 AM PDT",0,0,0,1,0,0,1,0,0,1,0,0,0,0,0,44328,"false","false","https://parkingreform.org/mandates-map/city_detail/Wilkes-Barre_PA.html",41.2464824,-75.8817316,"Wilkes-BarrePAUS","City Center","City Center All","city",0.2,"Wilkes-Barre, PA","not_special_icon"
"814","Mankato","MN","US","Uses and buildings located in the CBD-C, Central Business District-Core, are exempt from the minimum parking requirements. However, the City Council may require off-street parking to be provided for conditional uses in the CBD-C.","Implemented","Eliminate Parking Minimums","City Center/Business District","All Uses","Samuel Deetz","","March 27, 2023 at 5:31:13 PM PDT",1,0,0,1,0,0,1,0,0,1,0,0,0,0,0,44488,"false","false","https://parkingreform.org/mandates-map/city_detail/Mankato_MN.html",44.1634663,-93.9993505,"MankatoMNUS","City Center","City Center All","city",0.2,"Mankato, MN","not_special_icon"
"815","Moorhead","MN","US","The MU-1 downtown mixed use zoning district is exempt from minimum parking requirements.","Implemented","Eliminate Parking Minimums","City Center/Business District","All Uses","Samuel Deetz","Jan 27, 2014","April 4, 2023 at 10:06:23 AM PDT",0,0,0,1,0,0,1,0,0,1,0,0,0,0,0,44505,"false","false","https://parkingreform.org/mandates-map/city_detail/Moorhead_MN.html",46.8739081,-96.7538674,"MoorheadMNUS","City Center","City Center All","city",0.2,"Moorhead, MN","not_special_icon"
"816","Stephenson County","IL","US","Existing central business districts of municipalities are exempt from off-street parking requirements.","Implemented","Eliminate Parking Minimums","City Center/Business District","All Uses","Samuel Deetz","","April 4, 2023 at 7:20:33 PM PDT",0,0,0,1,0,0,1,0,0,1,0,0,0,0,0,44630,"false","false","https://parkingreform.org/mandates-map/city_detail/StephensonCounty_IL.html",42.3503474,-89.6735637,"Stephenson CountyILUS","City Center","City Center All","city",0.2,"Stephenson County, IL","not_special_icon"
"817","Fond du Lac","WI","US","Off-street parking is not required for uses in the Central Business District except for buildings constructed or used for residential living units as the principal land use. The Central Business District is defined as the area bounded by Marr Street on the east, Merrill Street on the north, the East Branch of the Fond du Lac River on the west, and Western Avenue and Fourth Street on the south.","Implemented","Eliminate Parking Minimums","City Center/Business District","Commercial","Samuel Deetz","","March 18, 2023 at 5:06:35 PM PDT",0,0,0,1,0,0,1,0,0,0,0,1,0,0,0,44678,"false","false","https://parkingreform.org/mandates-map/city_detail/FondduLac_WI.html",43.7748763,-88.4458033,"Fond du LacWIUS","City Center","City Center","building",0.2,"Fond du Lac, WI","not_special_icon"
"818","Plainfield","IL","US","Small residential and business land uses within the Downtown Parking Zone (DPZ) are exempt from the minimum parking requirements. However, If a commercial land use has a gross floor area of five thousand (5,000) square feet or more, then the standards apply. If parking is required of a particular use, nearby on-street parking spaces and municipal parking lots may count towards off-street parking spaces. Commercial establishments within the DPZ shall not provide a number of off-street parking spaces that is greater than one hundred (100) percent of the parking requirement for that particular establishment's land use.","Implemented","Eliminate Parking Minimums, Parking Maximums, Reduce Parking Minimums","City Center/Business District","All Uses","Samuel Deetz","","March 18, 2023 at 6:47:39 PM PDT",0,0,0,1,0,0,1,1,1,1,0,0,0,0,0,44762,"false","false","https://parkingreform.org/mandates-map/city_detail/Plainfield_IL.html",41.6086711,-88.2054345,"PlainfieldILUS","City Center","City Center All","city",0.2,"Plainfield, IL","not_special_icon"
"819","Winter Haven","FL","US","In 2000, Winter Haven adopted a new Downtown Commercial zoning district that exempted all land uses within it from parking requirements.","Implemented","Eliminate Parking Minimums","City Center/Business District","Commercial","Sean Martin","Jan 1, 2000","April 18, 2022 at 1:11:03 PM PDT",1,0,0,1,0,0,1,0,0,0,0,1,0,0,0,44955,"","","https://parkingreform.org/mandates-map/city_detail/WinterHaven_FL.html",28.0222435,-81.7328568,"Winter HavenFLUS","City Center","City Center","building",0.2,"Winter Haven, FL","not_special_icon"
"820","Huntington","WV","US","Off-street parking in the C-1 district has been reduced by 50% for nonresidential uses. Nonresidential uses within 660ft. of a public parking lot will are exempt from off-street parking requirements.","Implemented","Reduce Parking Minimums","City Center/Business District","Commercial","Shae Strait","","June 15, 2022 at 1:15:55 PM PDT",1,0,0,1,0,0,0,1,0,0,0,1,0,0,0,45110,"false","false","https://parkingreform.org/mandates-map/city_detail/Huntington_WV.html",38.4192496,-82.445154,"HuntingtonWVUS","City Center","City Center","building",0.2,"Huntington, WV","not_special_icon"
"821","Elmhurst","IL","US","In the CBC Central Business Core District, CBOC Central Business Outer Core District, and CBOCR Central Business Outer Core Residential District accessory off-street parking is not required except for residential uses.","Implemented","Eliminate Parking Minimums","City Center/Business District","Commercial","Samuel Deetz","","March 18, 2023 at 7:13:03 PM PDT",0,0,0,1,0,0,1,0,0,0,0,1,0,0,0,45786,"false","false","https://parkingreform.org/mandates-map/city_detail/Elmhurst_IL.html",41.8994745,-87.9403418,"ElmhurstILUS","City Center","City Center","building",0.2,"Elmhurst, IL","not_special_icon"
"822","Farmington","NM","US","The CB Central Business District is exempt from minimum parking requirements.","Implemented","Eliminate Parking Minimums","City Center/Business District","All Uses","Samuel Deetz","","April 6, 2023 at 8:57:02 PM PDT",0,0,0,1,0,0,1,0,0,1,0,0,0,0,0,46624,"false","false","https://parkingreform.org/mandates-map/city_detail/Farmington_NM.html",36.7291152,-108.205445,"FarmingtonNMUS","City Center","City Center All","city",0.2,"Farmington, NM","not_special_icon"
"823","Salina","KS","US","No off-street parking is required for any structure in the C-4 central business district except residences. Citywide, the total number of parking spaces provided for a single-family, a two-family or multiple-family dwelling may not exceed the requirements by more than fifty (50) percent or four (4) spaces, whichever number is greater.","Implemented","Eliminate Parking Minimums, Parking Maximums","City Center/Business District","Commercial","Samuel Deetz","","April 9, 2023 at 7:42:54 PM PDT",0,0,0,1,0,0,1,0,1,0,0,1,0,0,0,46889,"false","false","https://parkingreform.org/mandates-map/city_detail/Salina_KS.html",38.8402805,-97.6114237,"SalinaKSUS","City Center","City Center","building",0.2,"Salina, KS","not_special_icon"
"824","Charlottesville","VA","US","Charlottesville has eliminated parking minimums in the city center and a special university district. There is a zoning overlay that also eliminates mandates for smaller developments and reduces mandates for larger developments.","Implemented","Eliminate Parking Minimums","City Center/Business District","All Uses","Danny Yoder","","June 24, 2022 at 12:41:00 PM PDT",1,0,0,1,0,0,1,0,0,1,0,0,0,0,0,47096,"false","false","https://parkingreform.org/mandates-map/city_detail/Charlottesville_VA.html",38.029306,-78.4766781,"CharlottesvilleVAUS","City Center","City Center All","city",0.2,"Charlottesville, VA","not_special_icon"
"825","Roswell","NM","US","There are no minimum parking requirements in Roswell's C-3 (downtown) district.","Implemented","Eliminate Parking Minimums","City Center/Business District","All Uses","","","June 21, 2022 at 11:39:11 AM PDT",1,0,0,1,0,0,1,0,0,1,0,0,0,0,0,47551,"false","false","https://parkingreform.org/mandates-map/city_detail/Roswell_NM.html",33.3943282,-104.5229518,"RoswellNMUS","City Center","City Center All","city",0.2,"Roswell, NM","not_special_icon"
"826","Minot","ND","US","The CBD District is exempt from minimum parking requirements.","Implemented","Eliminate Parking Minimums","City Center/Business District","All Uses","Samuel Deetz","","March 14, 2023 at 8:09:42 PM PDT",0,0,0,1,0,0,1,0,0,1,0,0,0,0,0,48377,"false","false","https://parkingreform.org/mandates-map/city_detail/Minot_ND.html",48.23251,-101.296273,"MinotNDUS","City Center","City Center All","city",0.2,"Minot, ND","not_special_icon"
"827","Harrisburg","PA","US","Off-street parking requirements do not apply to all land uses within the Downtown Center and Commercial Neighborhood Zoning Districts.","Implemented","Eliminate Parking Minimums","City Center/Business District","All Uses","","","June 21, 2022 at 11:00:19 AM PDT",1,0,0,1,0,0,1,0,0,1,0,0,0,0,0,49271,"","","https://parkingreform.org/mandates-map/city_detail/Harrisburg_PA.html",40.2663107,-76.8861122,"HarrisburgPAUS","City Center","City Center All","city",0.2,"Harrisburg, PA","not_special_icon"
"828","Dunwoody","GA","US","Dunwoody has no minimum parking requirements. The city converted parking minimums into parking maximums in 2019.","Implemented","Eliminate Parking Minimums, Parking Maximums","Citywide","All Uses","Caleb Racicot","Jan 1, 2019","June 24, 2022 at 12:13:46 PM PDT",1,0,1,0,0,0,1,0,1,1,0,0,0,0,1,49356,"false","false","https://parkingreform.org/mandates-map/city_detail/Dunwoody_GA.html",33.9463786,-84.3342686,"DunwoodyGAUS","Citywide","Citywide All","city",0.2,"Dunwoody, GA","not_special_icon"
"829","Biloxi","MS","US","Development in the Downtown (DT) District is exempt from the minimum off-street parking requirements.","Implemented","Eliminate Parking Minimums","City Center/Business District","All Uses","Samuel Deetz","","April 1, 2023 at 10:14:26 AM PDT",0,0,0,1,0,0,1,0,0,1,0,0,0,0,0,49449,"false","false","https://parkingreform.org/mandates-map/city_detail/Biloxi_MS.html",30.4007626,-88.8893818,"BiloxiMSUS","City Center","City Center All","city",0.2,"Biloxi, MS","not_special_icon"
"830","Wilson","NC","US","There are no minimum parking requirements for land uses in the R/A, OS, IMX and CCMX Districts.

There are no minimum parking requirements for industrial, religious institutions, and some commercial land uses ('amusements [indoor & outdoor]'). 

Parking maximums are set as twice the minimum requirement. Exemptions to parking maximums can be applied to single/two family dwellings and if the parking areas exceeding the maximum requirements are installed using Low Impact Development (LID) treatment OR the minimum number of trees is 1 tree per 10 spaces.  ","Implemented","Eliminate Parking Minimums, Parking Maximums","City Center/Business District","All Uses","","","June 14, 2022 at 11:27:03 AM PDT",1,0,0,1,0,0,1,0,1,1,0,0,0,0,0,49459,"","","https://parkingreform.org/mandates-map/city_detail/Wilson_NC.html",35.7212689,-77.9155395,"WilsonNCUS","City Center","City Center All","city",0.2,"Wilson, NC","not_special_icon"
"831","Bozeman","MT","US","Bozeman eliminated minimum parking requirements in the Midtown Urban Renewal District.","Implemented","Eliminate Parking Minimums","City Center/Business District","All Uses","David Fine","","May 11, 2022 at 3:01:10 PM PDT",1,0,0,1,0,0,1,0,0,1,0,0,0,0,0,49831,"","","https://parkingreform.org/mandates-map/city_detail/Bozeman_MT.html",45.6794293,-111.044047,"BozemanMTUS","City Center","City Center All","city",0.2,"Bozeman, MT","not_special_icon"
"832","Sheboygan","WI","US","The Central Commercial (CC) District and the Central Parking Waiver Area (defined by Jefferson Avenue to Ontario Avenue and 7th to 9th Streets) are both exempt from minimum parking requirements.","Implemented","Eliminate Parking Minimums","City Center/Business District","All Uses","Samuel Deetz","","March 18, 2023 at 11:52:50 AM PDT",0,0,0,1,0,0,1,0,0,1,0,0,0,0,0,49929,"false","false","https://parkingreform.org/mandates-map/city_detail/Sheboygan_WI.html",43.7508284,-87.71453,"SheboyganWIUS","City Center","City Center All","city",0.2,"Sheboygan, WI","not_special_icon"
"833","Twin Falls","ID","US","In the Downtown P1 District, no parking is mandated. In the P2 district, parking mandates are Reduced by 30% for non-residential uses. ","Implemented","Eliminate Parking Minimums","City Center/Business District","All Uses","","","May 24, 2022 at 3:05:49 PM PDT",1,0,0,1,0,0,1,0,0,1,0,0,0,0,0,50197,"","","https://parkingreform.org/mandates-map/city_detail/TwinFalls_ID.html",42.5704456,-114.4602554,"Twin FallsIDUS","City Center","City Center All","city",0.2,"Twin Falls, ID","not_special_icon"
"834","Joplin","MO","US","No minimum parking requirements in Central Business District.","Proposed","Reduce Parking Minimums","City Center/Business District","All Uses","Sam Anselm","","May 24, 2022 at 2:55:55 PM PDT",1,0,0,1,0,0,0,1,0,1,0,0,0,0,0,50925,"","","https://parkingreform.org/mandates-map/city_detail/Joplin_MO.html",37.08418,-94.51323,"JoplinMOUS","City Center","City Center All","city",0.2,"Joplin, MO","not_special_icon"
"835","Grand Island","NE","US","No car parking is required in the Downtown Business District and the Four Street Business District. ","Implemented","Eliminate Parking Minimums","City Center/Business District","Commercial","Chad Nabity","","June 28, 2022 at 11:23:22 AM PDT",1,0,0,1,0,0,1,0,0,0,0,1,0,0,0,51267,"","","https://parkingreform.org/mandates-map/city_detail/GrandIsland_NE.html",40.924271,-98.338685,"Grand IslandNEUS","City Center","City Center","building",0.2,"Grand Island, NE","not_special_icon"
"836","Collierville","TN","US","For any activity permitted by right in the Central Business District, accessory off-street parking is not required. In addition, parking maximums exist for commercial uses in the CBD.","Implemented","Eliminate Parking Minimums, Parking Maximums","City Center/Business District","All Uses","Samuel Deetz","","March 20, 2023 at 3:42:49 PM PDT",0,0,0,1,0,0,1,0,1,1,0,0,0,0,0,51324,"false","false","https://parkingreform.org/mandates-map/city_detail/Collierville_TN.html",35.042036,-89.6645266,"ColliervilleTNUS","City Center","City Center All","city",0.2,"Collierville, TN","not_special_icon"
"837","Mooresville ","NC","US","Mooresville has removed parking minimums in its downtown district and established a new parking maximum of 125% of the minimum in all other zoning districts.","Implemented","Eliminate Parking Minimums, Parking Maximums","City Center/Business District","All Uses","David Cole","Feb 1, 2022","February 13, 2023 at 1:27:10 PM PST",1,0,0,1,0,0,1,0,1,1,0,0,0,0,0,51594,"false","false","https://parkingreform.org/mandates-map/city_detail/Mooresville_NC.html",35.5848596,-80.8100724,"Mooresville NCUS","City Center","City Center All","city",0.2,"Mooresville , NC","not_special_icon"
"838","La Crosse","WI","US","On March 10, 2022 La Crosse eliminated parking mandates for non-residential uses in Local Business, Commercial, and Community Business zones. Previously La Crosse had no parking requirements only in Industrial zones.","Implemented","Eliminate Parking Minimums","City Center/Business District","Commercial, Industrial","Patrick Siegman","Mar 10, 2022","March 27, 2023 at 11:28:38 PM PDT",1,0,0,1,0,0,1,0,0,0,0,1,0,0,0,51666,"false","false","https://parkingreform.org/mandates-map/city_detail/LaCrosse_WI.html",43.8014053,-91.2395429,"La CrosseWIUS","City Center","City Center","building",0.2,"La Crosse, WI","not_special_icon"
"839","Ogle County","IL","US","Off street parking facilities required for churches may be reduced by fifty percent (50%) where churches are located in nonresidential districts and within three hundred feet (300') of usable public or private off street parking areas.","Implemented","Reduce Parking Minimums","City Center/Business District","Other","Samuel Deetz","","April 13, 2023 at 3:18:52 PM PDT",0,0,0,1,0,0,0,1,0,0,0,0,0,0,0,51788,"false","false","https://parkingreform.org/mandates-map/city_detail/OgleCounty_IL.html",42.0397014,-89.3138599,"Ogle CountyILUS","City Center","City Center","car",0.2,"Ogle County, IL","not_special_icon"
"840","Normal","IL","US","Permitted business and office uses in the B-2 Central Business District are exempt from off-street parking requirements. This exemption does not apply to residential dwelling uses.","Implemented","Eliminate Parking Minimums","City Center/Business District","Commercial","Samuel Deetz","","April 4, 2023 at 3:11:04 PM PDT",0,0,0,1,0,0,1,0,0,0,0,1,0,0,0,52736,"false","false","https://parkingreform.org/mandates-map/city_detail/Normal_IL.html",40.5092961,-88.9843937,"NormalILUS","City Center","City Center","building",0.2,"Normal, IL","not_special_icon"
"841","Olympia","WA","US","Olympia enacted specific zone district requirements, eliminating residential parking minimums as well as minimums for all existing commercial buildings, and new commercial construction or expansion totaling under 3,000 square feet within the Downtown Exempt Parking Area.","Implemented","Eliminate Parking Minimums","City Center/Business District","Residential, Commercial","Max DeJarnatt","","May 11, 2022 at 2:54:31 PM PDT",1,0,0,1,0,0,1,0,0,0,1,1,0,0,0,52882,"","","https://parkingreform.org/mandates-map/city_detail/Olympia_WA.html",47.0451022,-122.8950075,"OlympiaWAUS","City Center","City Center","laptop",0.2,"Olympia, WA","not_special_icon"
"842","Wheaton","IL","US","No off-street parking is required in the C-2 Zoning District","Implemented","Eliminate Parking Minimums","City Center/Business District","All Uses","Samuel Deetz","","March 27, 2023 at 6:03:19 PM PDT",1,0,0,1,0,0,1,0,0,1,0,0,0,0,0,53126,"false","false","https://parkingreform.org/mandates-map/city_detail/Wheaton_IL.html",41.8646959,-88.1101709,"WheatonILUS","City Center","City Center All","city",0.2,"Wheaton, IL","not_special_icon"
"843","Mount Prospect","IL","US","Mount Prospect lowered the parking requirement in the B-5 central commercial district and the B-5c central commercial core district. ","Implemented","Reduce Parking Minimums","City Center/Business District","All Uses","","","June 30, 2022 at 11:59:29 AM PDT",1,0,0,1,0,0,0,1,0,1,0,0,0,0,0,54165,"false","false","https://parkingreform.org/mandates-map/city_detail/MountProspect_IL.html",42.0664167,-87.9372908,"Mount ProspectILUS","City Center","City Center All","city",0.2,"Mount Prospect, IL","not_special_icon"
"844","Colton","CA","US","Colton California has reduced parking minimums for commercial and residential in the downtown and mixed used neighborhoods but has not completely eliminated minimum parking in any area.","Implemented","Reduce Parking Minimums","City Center/Business District","All Uses","Bobby Siemiaszko","","May 24, 2022 at 1:24:13 PM PDT",1,0,0,1,0,0,0,1,0,1,0,0,0,0,0,54824,"","","https://parkingreform.org/mandates-map/city_detail/Colton_CA.html",34.0739016,-117.3136547,"ColtonCAUS","City Center","City Center All","city",0.2,"Colton, CA","not_special_icon"
"845","Manhattan","KS","US","There are no minimum parking requirements in the Downtown District (C-4 District), limited requirements for business and apartment uses in the Aggieville District (C-3 District), and reduced parking requirements in the M-FRO District.","Implemented","Eliminate Parking Minimums","City Center/Business District, Main Street/Special","All Uses","Chad Bunger","","April 26, 2022 at 2:11:23 PM PDT",1,0,0,1,0,1,1,0,0,1,0,0,0,0,0,55290,"","","https://parkingreform.org/mandates-map/city_detail/Manhattan_KS.html",39.1836082,-96.5716694,"ManhattanKSUS","City Center","City Center All","city",0.2,"Manhattan, KS","not_special_icon"
"846","Tigard","OR","US","No minimum parking requirements. Full repeal adopted 12/13/22 effective 30 days later.","Implemented","Eliminate Parking Minimums","Citywide","All Uses","Schuyler Warren","Dec 13, 2022","March 27, 2023 at 5:33:26 PM PDT",1,0,1,0,0,0,1,0,0,1,0,0,0,0,1,55514,"","","https://parkingreform.org/mandates-map/city_detail/Tigard_OR.html",45.4307473,-122.771933,"TigardORUS","Citywide","Citywide All","city",0.2,"Tigard, OR","not_special_icon"
"847","Pocatello","ID","US","Parking requirements for all permitted uses are waived in the Central Commercial Zoning District and Warehouse Historic District.","Implemented","Eliminate Parking Minimums","City Center/Business District","All Uses","Jim Anglesey","","June 24, 2022 at 12:29:10 PM PDT",1,0,0,1,0,0,1,0,0,1,0,0,0,0,0,55525,"false","false","https://parkingreform.org/mandates-map/city_detail/Pocatello_ID.html",42.8620287,-112.450627,"PocatelloIDUS","City Center","City Center All","city",0.2,"Pocatello, ID","not_special_icon"
"848","Corvallis","OR","US","The Corvallis City Council adopted an ordinance at its Nov 21, 2022 council meeting to not enforce parking mandates citywide starting Dec 31, 2022.","Implemented","Eliminate Parking Minimums","Citywide","All Uses","Evan Manvel","Nov 21, 2022","January 22, 2023 at 3:37:54 PM PST",0,0,1,0,0,0,1,0,0,1,0,0,0,0,1,58028,"false","false","https://parkingreform.org/mandates-map/city_detail/Corvallis_OR.html",44.5645659,-123.2620435,"CorvallisORUS","Citywide","Citywide All","city",0.2,"Corvallis, OR","not_special_icon"
"849","Des Plaines","IL","US","Residential uses within 2,500 ft of an operational or proposed passenger rail station, or an operational bus rapid transit station in the C-3 Mixed-Use PUD zone may reduce parking requirements","Implemented","Reduce Parking Minimums","City Center/Business District, Transit Oriented","Residential","","","March 20, 2023 at 8:50:20 PM PDT",1,0,0,1,1,0,0,1,0,0,1,0,0,0,0,58316,"false","false","https://parkingreform.org/mandates-map/city_detail/DesPlaines_IL.html",42.0415823,-87.8873916,"Des PlainesILUS","City Center","City Center","home",0.2,"Des Plaines, IL","not_special_icon"
"850","Casper","WY","US","No parking is required for commercial uses within the C-3 Central Business District.","Implemented","Eliminate Parking Minimums","City Center/Business District","Commercial","Samuel Deetz","","April 1, 2023 at 9:31:15 AM PDT",0,0,0,1,0,0,1,0,0,0,0,1,0,0,0,59038,"false","false","https://parkingreform.org/mandates-map/city_detail/Casper_WY.html",42.8501191,-106.325138,"CasperWYUS","City Center","City Center","building",0.2,"Casper, WY","not_special_icon"
"851","Lyon County","NV","US","For any use categorized as a ""commercial"" or ""industrial"" use, off-street vehicle parking spaces may not be provided in an amount that is more than one hundred twenty five percent (125%) of the minimum requirements. If application of the maximum parking standard would result in less than six parking spaces, the development may be allowed six parking spaces.","Implemented","Parking Maximums","Citywide","Commercial, Industrial","Samuel Deetz","","April 1, 2023 at 3:06:50 PM PDT",0,0,1,0,0,0,0,0,1,0,0,1,0,0,0,59235,"false","false","https://parkingreform.org/mandates-map/city_detail/LyonCounty_NV.html",38.9887898,-119.1822042,"Lyon CountyNVUS","Citywide","Citywide","building",0.2,"Lyon County, NV","not_special_icon"
