"","city","state","country","report_summary","report_status","report_type","report_magnitude","land_uses","reporter_name","date_of_reform","last_updated","is_verified","is_magnitude_regional","is_magnitude_citywide","is_magnitude_citycenter","is_magnitude_transit","is_magnitude_mainstreet","is_type_eliminated","is_type_reduced","is_type_maximums","is_uses_alluses","is_uses_residential","is_uses_commercial","is_uses_lowdensity","is_uses_multifamily","is_no_mandate_city","population","is_notable","is_recent","citation_url","lat","long","id","magnitude_encoded","border_encoded","land_use_encoded","population_encoded","city_search","is_special"
"560","Le Mars","IA","US","Off-street parking and loading requirements are not required for any use in the “B-3” Central Business District, except residential dwellings, which must provide one parking space per dwelling unit.","Implemented","Eliminate Parking Minimums","City Center/Business District","Commercial","Samuel Deetz","","April 10, 2023 at 8:54:46 PM PDT",0,0,0,1,0,0,1,0,0,0,0,1,0,0,0,10571,"false","false","https://parkingreform.org/mandates-map/city_detail/LeMars_IA.html",42.792151,-96.1662993,"Le MarsIAUS","City Center","City Center","building",0.2,"Le Mars, IA","not_special_icon"
"561","Portage","WI","US","Parking space requirements are waived within the B-2 downtown district, except for developments exceeding 40,000 square feet.","Implemented","Eliminate Parking Minimums","City Center/Business District","All Uses","Samuel Deetz","","March 18, 2023 at 5:24:21 PM PDT",0,0,0,1,0,0,1,0,0,1,0,0,0,0,0,10581,"false","false","https://parkingreform.org/mandates-map/city_detail/Portage_WI.html",43.539494,-89.461334,"PortageWIUS","City Center","City Center All","city",0.2,"Portage, WI","not_special_icon"
"562","Monroe","WI","US","Within the CMU District, the parking requirements are waived for non-residential uses. Residential uses must provide evidence of the availability of off-street public or private parking in the amount of one parking space per dwelling unit within 1,000 feet of the unit. In addition, no site plan may be approved for a multifamily or nonresidential use which contains more than 125% of the development's minimum number of required parking spaces.","Implemented","Eliminate Parking Minimums","City Center/Business District","Commercial","Samuel Deetz","","March 18, 2023 at 4:16:44 PM PDT",0,0,0,1,0,0,1,0,0,0,0,1,0,0,0,10661,"false","false","https://parkingreform.org/mandates-map/city_detail/Monroe_WI.html",42.6136586,-89.58520522,"MonroeWIUS","City Center","City Center","building",0.2,"Monroe, WI","not_special_icon"
"563","Petal","MS","US","Off-street car parking is not required for any use located in the C-3 central business district.","Implemented","Eliminate Parking Minimums","City Center/Business District","All Uses","Samuel Deetz","","April 1, 2023 at 9:56:17 AM PDT",0,0,0,1,0,0,1,0,0,1,0,0,0,0,0,11010,"false","false","https://parkingreform.org/mandates-map/city_detail/Petal_MS.html",31.3465627,-89.2600605,"PetalMSUS","City Center","City Center All","city",0.2,"Petal, MS","not_special_icon"
"564","Van Wert ","OH","US","The city of Van Wert has eliminated parking minimums for all uses in the downtown historic district, an approximately 20-block area.","Passed","Eliminate Parking Minimums","City Center/Business District","All Uses","","","June 27, 2022 at 12:24:02 PM PDT",1,0,0,1,0,0,1,0,0,1,0,0,0,0,0,11045,"false","false","https://parkingreform.org/mandates-map/city_detail/VanWert_OH.html",40.8616225,-84.5755178,"Van Wert OHUS","City Center","City Center All","city",0.2,"Van Wert , OH","not_special_icon"
"565","Brandon","SD","US","Minimum parking requirements are not applicable to property in the CB Central Business District, except for residential uses which are authorized by a conditional use permit. ","Implemented","Eliminate Parking Minimums","City Center/Business District","Commercial","Samuel Deetz","","April 2, 2023 at 6:51:57 PM PDT",0,0,0,1,0,0,1,0,0,0,0,1,0,0,0,11048,"false","false","https://parkingreform.org/mandates-map/city_detail/Brandon_SD.html",43.5909294,-96.5874544,"BrandonSDUS","City Center","City Center","building",0.2,"Brandon, SD","not_special_icon"
"566","Grand Rapids","MN","US","Uses constructed in the CBD zone are exempt from minimum parking requirements.","Implemented","Eliminate Parking Minimums","City Center/Business District","All Uses","Samuel Deetz","","March 16, 2023 at 9:06:23 PM PDT",0,0,0,1,0,0,1,0,0,1,0,0,0,0,0,11126,"false","false","https://parkingreform.org/mandates-map/city_detail/GrandRapids_MN.html",47.237166,-93.530214,"Grand RapidsMNUS","City Center","City Center All","city",0.2,"Grand Rapids, MN","not_special_icon"
"567","Summit","IL","US","For nonresidential uses, schools and assembly uses must provide off street parking space. However, there is no minimum off-street motor vehicle parking requirement for other nonresidential uses, although uses requiring special use approval may be required to provide parking for approval.","Implemented","Eliminate Parking Minimums","Citywide","Commercial, Industrial, Other","Samuel Deetz","","April 16, 2023 at 8:45:27 AM PDT",0,0,1,0,0,0,1,0,0,0,0,1,0,0,0,11161,"false","false","https://parkingreform.org/mandates-map/city_detail/Summit_IL.html",41.7880876,-87.810334,"SummitILUS","Citywide","Citywide","building",0.2,"Summit, IL","not_special_icon"
"568","Union City","TN","US","The B-3 (Central Business) District, except dwellings, is exempt from minimum parking requirements.","Implemented","Eliminate Parking Minimums","City Center/Business District","Commercial","Samuel Deetz","","March 27, 2023 at 5:03:30 PM PDT",1,0,0,1,0,0,1,0,0,0,0,1,0,0,0,11170,"false","false","https://parkingreform.org/mandates-map/city_detail/UnionCity_TN.html",36.4242303,-89.0570096,"Union CityTNUS","City Center","City Center","building",0.2,"Union City, TN","not_special_icon"
"569","Milford","DE","US","No off-street parking is required in the C-2 Central Business District.","Implemented","Eliminate Parking Minimums","City Center/Business District","All Uses","Samuel Deetz","","April 1, 2023 at 9:24:44 AM PDT",0,0,0,1,0,0,1,0,0,1,0,0,0,0,0,11190,"false","false","https://parkingreform.org/mandates-map/city_detail/Milford_DE.html",38.9130453,-75.4278733,"MilfordDEUS","City Center","City Center All","city",0.2,"Milford, DE","not_special_icon"
"570","Lansing","KS","US","Minimum parking requirements may be reduced according to the following strategies:
1. Walkable Commercial Contexts. In the B-1 and B-2 districts, any use under 2,000 square feet is exempt from providing on-site parking, and all other uses in the B-1 and B-2 districts may reduce the required on-site parking by 30% provided the project is designed in a compact, walkable format with smaller blocks and walkable streets.
2. On-street Parking Credit. All on-street parking within 600 feet of any lot frontage may count towards the parking requirement at a rate of one space for every three on-street spaces. However, any on-street parking in front of residential lots shall not count for nonresidential uses in the area.
3. Bicycle Parking Credit. All on-site bicycle parking may reduce the required vehicle parking at a rate of one space for every four bicycle parking spaces up to a maximum of 15% of the required vehicle parking.
4. Public Parking Credit. Any site within 600 feet of a public parking area may reduce the required vehicle parking at a rate of one space for every two public parking spaces.

Parking maximums are set at 120% of the minimums, but may be exceeded through several mitigation strategies.","Implemented","Reduce Parking Minimums, Eliminate Parking Minimums, Parking Maximums","City Center/Business District","All Uses","Samuel Deetz","","April 9, 2023 at 7:47:45 PM PDT",0,0,0,1,0,0,1,1,1,1,0,0,0,0,0,11239,"false","false","https://parkingreform.org/mandates-map/city_detail/Lansing_KS.html",39.248739,-94.900246,"LansingKSUS","City Center","City Center All","city",0.2,"Lansing, KS","not_special_icon"
"571","Two Rivers","WI","US","Within the area lying between the West Twin River and 22nd Street and between Jefferson and Adams Streets, which includes properties on both sides of Jefferson, Adams and 22nd Streets, newly established, converted or expanded uses excluding churches, theaters, arenas, auditoriums and similar places of public gathering as well as residences, are exempt from the requirements for off-street parking and loading space.","Implemented","Eliminate Parking Minimums","City Center/Business District","Commercial, Industrial, Medical","Samuel Deetz","","March 27, 2023 at 5:12:55 PM PDT",1,0,0,1,0,0,1,0,0,0,0,1,0,0,0,11271,"false","false","https://parkingreform.org/mandates-map/city_detail/TwoRivers_WI.html",44.1538845,-87.5692479,"Two RiversWIUS","City Center","City Center","building",0.2,"Two Rivers, WI","not_special_icon"
"572","Spencer","IA","US","The CBD Zoning District is exempt from minimum parking requirements.","Implemented","Eliminate Parking Minimums","City Center/Business District","All Uses","Samuel Deetz","","April 1, 2023 at 9:07:03 PM PDT",0,0,0,1,0,0,1,0,0,1,0,0,0,0,0,11325,"false","false","https://parkingreform.org/mandates-map/city_detail/Spencer_IA.html",43.1415519,-95.1477536,"SpencerIAUS","City Center","City Center All","city",0.2,"Spencer, IA","not_special_icon"
"573","Campbellsville","KY","US","The Central Business District (B-3) is exempt from minimum parking requirements.","Implemented","Eliminate Parking Minimums","City Center/Business District","All Uses","Samuel Deetz","","April 1, 2023 at 2:31:34 PM PDT",0,0,0,1,0,0,1,0,0,1,0,0,0,0,0,11426,"false","false","https://parkingreform.org/mandates-map/city_detail/Campbellsville_KY.html",37.3433974,-85.3419069,"CampbellsvilleKYUS","City Center","City Center All","city",0.2,"Campbellsville, KY","not_special_icon"
"574","Mexico","MO","US","The C-3 Business District is exempt from minimum parking requirements.","Implemented","Eliminate Parking Minimums","City Center/Business District","All Uses","Samuel Deetz","","March 15, 2023 at 10:25:27 PM PDT",0,0,0,1,0,0,1,0,0,1,0,0,0,0,0,11469,"false","false","https://parkingreform.org/mandates-map/city_detail/Mexico_MO.html",39.1697626,-91.8829484,"MexicoMOUS","City Center","City Center All","city",0.2,"Mexico, MO","not_special_icon"
"575","Oskaloosa","IA","US","Any use within the DC downtown commercial district other than downtown residential is exempt from the off-street parking requirements.","Implemented","Eliminate Parking Minimums","City Center/Business District","Commercial","Samuel Deetz","","March 18, 2023 at 7:53:56 PM PDT",0,0,0,1,0,0,1,0,0,0,0,1,0,0,0,11558,"false","false","https://parkingreform.org/mandates-map/city_detail/Oskaloosa_IA.html",41.2951037,-92.6448451,"OskaloosaIAUS","City Center","City Center","building",0.2,"Oskaloosa, IA","not_special_icon"
"576","Covington","LA","US","Commercial establishments in the Division of St. John do not have any off-street parking requirements.","Implemented","Eliminate Parking Minimums","City Center/Business District","Commercial","Samuel Deetz","","April 6, 2023 at 1:24:40 PM PDT",0,0,0,1,0,0,1,0,0,0,0,1,0,0,0,11564,"false","false","https://parkingreform.org/mandates-map/city_detail/Covington_LA.html",30.4754702,-90.1009108,"CovingtonLAUS","City Center","City Center","building",0.2,"Covington, LA","not_special_icon"
"577","Branson","MO","US","Branson parking minimums were flipped to parking maximums. ","Implemented","Eliminate Parking Minimums, Parking Maximums","Citywide","All Uses","Joel Hornickel","Apr 10, 2018","June 24, 2022 at 12:30:46 PM PDT",1,0,1,0,0,0,1,0,1,1,0,0,0,0,1,11630,"","","https://parkingreform.org/mandates-map/city_detail/Branson_MO.html",36.6411357,-93.2175285,"BransonMOUS","Citywide","Citywide All","city",0.2,"Branson, MO","not_special_icon"
"578","Vermillion","SD","US","Minimum parking requirements are not applicable to property in the CB Central Business District.","Implemented","Eliminate Parking Minimums","City Center/Business District","All Uses","Samuel Deetz","","April 1, 2023 at 4:03:23 PM PDT",0,0,0,1,0,0,1,0,0,1,0,0,0,0,0,11695,"false","false","https://parkingreform.org/mandates-map/city_detail/Vermillion_SD.html",42.7795273,-96.929101,"VermillionSDUS","City Center","City Center All","city",0.2,"Vermillion, SD","not_special_icon"
"579","Winfield","KS","US","No off-street parking facilities are required in the C-4 Central Business District.","Implemented","Eliminate Parking Minimums","City Center/Business District","All Uses","Samuel Deetz","","April 6, 2023 at 3:14:13 PM PDT",0,0,0,1,0,0,1,0,0,1,0,0,0,0,0,11777,"false","false","https://parkingreform.org/mandates-map/city_detail/Winfield_KS.html",37.2397486,-96.9955919,"WinfieldKSUS","City Center","City Center All","city",0.2,"Winfield, KS","not_special_icon"
"580","Green River","WY","US","The B-2 Downtown Business District is not required to provide off-street parking spaces.","Implemented","Eliminate Parking Minimums","City Center/Business District","All Uses","Samuel Deetz","","April 1, 2023 at 9:34:12 AM PDT",0,0,0,1,0,0,1,0,0,1,0,0,0,0,0,11825,"false","false","https://parkingreform.org/mandates-map/city_detail/GreenRiver_WY.html",41.5290933,-109.466473,"Green RiverWYUS","City Center","City Center All","city",0.2,"Green River, WY","not_special_icon"
"581","Healdsburg","CA","US","Downtown Healdsburg has no parking requirements for non-residential uses for developments less than 15,000 square feet.","Implemented","Eliminate Parking Minimums","City Center/Business District","Commercial","Tony Jordan","","May 17, 2022 at 11:03:06 AM PDT",1,0,0,1,0,0,1,0,0,0,0,1,0,0,0,11845,"","","https://parkingreform.org/mandates-map/city_detail/Healdsburg_CA.html",38.6106812,-122.870138,"HealdsburgCAUS","City Center","City Center","building",0.2,"Healdsburg, CA","not_special_icon"
"582","Arkansas City","KS","US","No off-street parking facilities are required in the C-4 Central Business District.","Implemented","Eliminate Parking Minimums","City Center/Business District","All Uses","Samuel Deetz","","April 7, 2023 at 1:37:34 PM PDT",0,0,0,1,0,0,1,0,0,1,0,0,0,0,0,11974,"false","false","https://parkingreform.org/mandates-map/city_detail/ArkansasCity_KS.html",37.0622562,-97.0388338,"Arkansas CityKSUS","City Center","City Center All","city",0.2,"Arkansas City, KS","not_special_icon"
"583","Emeryville","CA","US","There are no minimum number of parking spaces required for any use, with the exception of accessible space provisions. The maximum number of parking spaces allowed shall be ten percent (10%) more than the estimated parking demand, specified in Table 9-4.404. 

All off-street parking spaces shall be leased or sold separately from the rental or purchase fees giving potential renters or buyers the option of renting or buying a residential unit at a price lower than would be the case if there were a single price for both the residential unit and the parking space(s).","Implemented","Eliminate Parking Minimums, Parking Maximums","Citywide","All Uses","","Jul 19, 2019","June 27, 2022 at 12:22:09 PM PDT",1,0,1,0,0,0,1,0,1,1,0,0,0,0,1,12000,"false","false","https://parkingreform.org/mandates-map/city_detail/Emeryville_CA.html",37.8314089,-122.2865266,"EmeryvilleCAUS","Citywide","Citywide All","city",0.2,"Emeryville, CA","not_special_icon"
"584","St. Peter","MN","US","The C-2 Central Business District is exempt from minimum parking requirements.","Implemented","Eliminate Parking Minimums","City Center/Business District","All Uses","Samuel Deetz","Nov 26, 2007","March 27, 2023 at 5:24:12 PM PDT",1,0,0,1,0,0,1,0,0,1,0,0,0,0,0,12066,"false","false","https://parkingreform.org/mandates-map/city_detail/St.Peter_MN.html",44.3238384,-93.9585295,"St. PeterMNUS","City Center","City Center All","city",0.2,"St. Peter, MN","not_special_icon"
"585","Centralia","IL","US","No off-street parking or loading spaces are required for any permitted use located within that portion of the B-2 Central Business District located east of the railroad tracks bounded by McCord Street and Third Street on the north and south and by Elm Street and Oak Street on the east and west and those properties located west of the railroad tracks bounded by Noleman Street and Second Street on the north and south and Chestnut Street and Walnut Street on the east and west.","Implemented","Eliminate Parking Minimums","City Center/Business District","All Uses","Samuel Deetz","","April 3, 2023 at 9:05:39 PM PDT",0,0,0,1,0,0,1,0,0,1,0,0,0,0,0,12182,"false","false","https://parkingreform.org/mandates-map/city_detail/Centralia_IL.html",38.5250491,-89.1334037,"CentraliaILUS","City Center","City Center All","city",0.2,"Centralia, IL","not_special_icon"
"586","Brattleboro","VT","US","Brattleboro has no off-street parking requirements in the city center district.","Implemented","Eliminate Parking Minimums","City Center/Business District","All Uses","Brian Bannon","","June 24, 2022 at 12:32:35 PM PDT",1,0,0,1,0,0,1,0,0,1,0,0,0,0,0,12184,"false","false","https://parkingreform.org/mandates-map/city_detail/Brattleboro_VT.html",42.8507588,-72.5572913,"BrattleboroVTUS","City Center","City Center All","city",0.2,"Brattleboro, VT","not_special_icon"
"587","West Plains","MO","US","The C-4 Central Business District is exempt from minimum parking requirements.","Implemented","Eliminate Parking Minimums","City Center/Business District","All Uses","Samuel Deetz","","March 18, 2023 at 11:32:31 AM PDT",0,0,0,1,0,0,1,0,0,1,0,0,0,0,0,12184,"false","false","https://parkingreform.org/mandates-map/city_detail/WestPlains_MO.html",36.7281652,-91.8525756,"West PlainsMOUS","City Center","City Center All","city",0.2,"West Plains, MO","not_special_icon"
"588","Spearfish","SD","US","For commercial uses, excluding new and used vehicle sales, minimum amounts of off-street parking facilities may be exceeded by only twenty (20) percent.","Implemented","Parking Maximums","Citywide","Commercial","Samuel Deetz","","April 1, 2023 at 3:56:18 PM PDT",0,0,1,0,0,0,0,0,1,0,0,1,0,0,0,12193,"false","false","https://parkingreform.org/mandates-map/city_detail/Spearfish_SD.html",44.490817,-103.85937,"SpearfishSDUS","Citywide","Citywide","building",0.2,"Spearfish, SD","not_special_icon"
"589","Effingham","IL","US","No off-street parking need be provided for any uses when they are located in the B-3 Central Business District.","Implemented","Eliminate Parking Minimums","City Center/Business District","All Uses","Samuel Deetz","","March 27, 2023 at 5:12:16 PM PDT",1,0,0,1,0,0,1,0,0,1,0,0,0,0,0,12221,"false","false","https://parkingreform.org/mandates-map/city_detail/Effingham_IL.html",39.1201433,-88.54348,"EffinghamILUS","City Center","City Center All","city",0.2,"Effingham, IL","not_special_icon"
"590","Beatrice","NE","US","Any use within the Central Business District (CBD) is exempt from the off-street parking requirements.","Implemented","Eliminate Parking Minimums","City Center/Business District","All Uses","Samuel Deetz","","March 27, 2023 at 4:45:52 PM PDT",1,0,0,1,0,0,1,0,0,1,0,0,0,0,0,12261,"false","false","https://parkingreform.org/mandates-map/city_detail/Beatrice_NE.html",40.266429,-96.747369,"BeatriceNEUS","City Center","City Center All","city",0.2,"Beatrice, NE","not_special_icon"
"591","Union","MO","US","The ""B-1"" Central Business District is exempt from meeting the on-site parking requirements.","Implemented","Eliminate Parking Minimums","City Center/Business District","All Uses","Samuel Deetz","","March 27, 2023 at 5:07:17 PM PDT",1,0,0,1,0,0,1,0,0,1,0,0,0,0,0,12348,"false","false","https://parkingreform.org/mandates-map/city_detail/Union_MO.html",38.4443875,-91.0082308,"UnionMOUS","City Center","City Center All","city",0.2,"Union, MO","not_special_icon"
"592","Port Washington","WI","US","Business uses in the B-4 Central Business District are exempt from the parking space requirement.","Implemented","Eliminate Parking Minimums","City Center/Business District","Commercial","Samuel Deetz","","March 18, 2023 at 12:13:26 PM PDT",0,0,0,1,0,0,1,0,0,0,0,1,0,0,0,12353,"false","false","https://parkingreform.org/mandates-map/city_detail/PortWashington_WI.html",43.3872247,-87.875644,"Port WashingtonWIUS","City Center","City Center","building",0.2,"Port Washington, WI","not_special_icon"
"593","Escanaba","MI","US","In 2022, Escanaba removed parking minimums for all non-residential uses while properties located within the E3 Central Commercial District were exempted from the residential parking requirements.","Implemented","Eliminate Parking Minimums","Citywide","Commercial, Industrial","Samuel Deetz","May 5, 2022","March 17, 2023 at 9:33:35 AM PDT",0,0,1,0,0,0,1,0,0,0,0,1,0,0,0,12450,"true","true","https://parkingreform.org/mandates-map/city_detail/Escanaba_MI.html",45.7455707,-87.0647434,"EscanabaMIUS","Citywide","Citywide","building",0.2,"Escanaba, MI","highlighed_icon"
"594","Boone","IA","US","The C-3 District, designated as the “Central Business Area”, is exempt from minimum parking requirements.","Implemented","Eliminate Parking Minimums","City Center/Business District","All Uses","Samuel Deetz","","April 1, 2023 at 8:41:15 PM PDT",0,0,0,1,0,0,1,0,0,1,0,0,0,0,0,12460,"false","false","https://parkingreform.org/mandates-map/city_detail/Boone_IA.html",42.0596994,-93.8802202,"BooneIAUS","City Center","City Center All","city",0.2,"Boone, IA","not_special_icon"
"595","Streator","IL","US","The Central Business District is exempt from minimum parking requirements.","Implemented","Eliminate Parking Minimums","City Center/Business District","All Uses","Samuel Deetz","","March 18, 2023 at 1:02:42 PM PDT",0,0,0,1,0,0,1,0,0,1,0,0,0,0,0,12500,"false","false","https://parkingreform.org/mandates-map/city_detail/Streator_IL.html",41.1210234,-88.8357361,"StreatorILUS","City Center","City Center All","city",0.2,"Streator, IL","not_special_icon"
"596","Brown Deer","WI","US","No more than 125 percent of the minimum required number of parking spaces may be provided for any particular use.","Implemented","Parking Maximums","Citywide","All Uses","Samuel Deetz","","March 27, 2023 at 5:14:51 PM PDT",1,0,1,0,0,0,0,0,1,1,0,0,0,0,0,12507,"false","false","https://parkingreform.org/mandates-map/city_detail/BrownDeer_WI.html",43.1744352,-87.972722,"Brown DeerWIUS","Citywide","Citywide All","city",0.2,"Brown Deer, WI","not_special_icon"
"597","Baraboo","WI","US","The Central Business District (B-l) is exempt from minimum parking requirements.","Implemented","Eliminate Parking Minimums","City Center/Business District","All Uses","Samuel Deetz","","March 18, 2023 at 12:01:04 PM PDT",0,0,0,1,0,0,1,0,0,1,0,0,0,0,0,12556,"false","false","https://parkingreform.org/mandates-map/city_detail/Baraboo_WI.html",43.4704014,-89.7437844,"BarabooWIUS","City Center","City Center All","city",0.2,"Baraboo, WI","not_special_icon"
"598","Fulton","MO","US","In the C-1 central business zoning district, businesses are not required to provide off-street parking.","Implemented","Eliminate Parking Minimums","City Center/Business District","Commercial","Samuel Deetz","","March 15, 2023 at 10:22:06 PM PDT",0,0,0,1,0,0,1,0,0,0,0,1,0,0,0,12600,"false","false","https://parkingreform.org/mandates-map/city_detail/Fulton_MO.html",38.8467082,-91.9479586,"FultonMOUS","City Center","City Center","building",0.2,"Fulton, MO","not_special_icon"
"599","Grantsville","UT","US","Any legally established use in the Main Street Retail Business District on Main Street may be changed to any other legal use without providing any additional off-street parking, provided no expansion of the existing principal structure has occurred.","Implemented","Eliminate Parking Minimums","Main Street/Special","All Uses","Samuel Deetz","","April 8, 2023 at 9:51:00 AM PDT",0,0,0,0,0,1,1,0,0,1,0,0,0,0,0,12617,"false","false","https://parkingreform.org/mandates-map/city_detail/Grantsville_UT.html",40.6000817,-112.463531,"GrantsvilleUTUS","Main Street","Main Street","city",0.2,"Grantsville, UT","not_special_icon"
"600","Ottawa","KS","US","No off-street parking facilities are required in the C-4 Central Business District.","Implemented","Eliminate Parking Minimums","City Center/Business District","All Uses","Samuel Deetz","","April 7, 2023 at 1:58:41 PM PDT",0,0,0,1,0,0,1,0,0,1,0,0,0,0,0,12625,"false","false","https://parkingreform.org/mandates-map/city_detail/Ottawa_KS.html",38.6153828,-95.2678474,"OttawaKSUS","City Center","City Center All","city",0.2,"Ottawa, KS","not_special_icon"
"601","Saint Marys","PA","US","The City has implemented the elimination of parking space minimums in the City Center/Business Zoning District.","Implemented","Eliminate Parking Minimums","City Center/Business District","All Uses","Matthew Pfeufer","Nov 18, 2019","April 6, 2023 at 9:38:33 PM PDT",1,0,0,1,0,0,1,0,0,1,0,0,0,0,0,12639,"false","false","https://parkingreform.org/mandates-map/city_detail/SaintMarys_PA.html",41.4280432,-78.5611275,"Saint MarysPAUS","City Center","City Center All","city",0.2,"Saint Marys, PA","not_special_icon"
"602","Grenada","MS","US","The B-3 Heavy Commercial CBD District is exempt from minimum parking requirements.","Implemented","Eliminate Parking Minimums","City Center/Business District","All Uses","Samuel Deetz","","April 1, 2023 at 10:10:44 AM PDT",0,0,0,1,0,0,1,0,0,1,0,0,0,0,0,12700,"false","false","https://parkingreform.org/mandates-map/city_detail/Grenada_MS.html",33.7690049,-89.8084192,"GrenadaMSUS","City Center","City Center All","city",0.2,"Grenada, MS","not_special_icon"
