"","...1","city","state","country","report_summary","report_status","report_type","report_magnitude","land_uses","reporter_name","is_verified","population","is_notable","is_recent","lat","long","id","magnitude_encoded","land_use_encoded","population_encoded","is_special","mag2"
"117",117,"Cedar Rapids","IA","US","Cedar Rapids has no parking required in the downtown district. There are many reductions available for parking requirements elsewhere.","Implemented","Reduce Parking Minimums, Eliminate Parking Minimums","City Center/Business District","All Uses","Seth Gunnerson",1,133562,NA,NA,41.9758872,-91.6704053,"Cedar RapidsIAUS","orange","city",0.4,"not_special_icon","City Center"
"118",118,"Champaign","IL","US","Champaign eliminated parking requirements for all multi-family dwellings in the ""University District"". No off-street parking is required for any use within the MFUniv, CB1, CB2, and CB3 Districts. Elderly housing is subject to reduced parking requirements in all zones.","Implemented","Eliminate Parking Minimums, Reduce Parking Minimums","Main Street/Special, City Center/Business District","All Uses","Ben LeRoy",1,88909,NA,NA,40.1164841,-88.2430932,"ChampaignILUS","orange","city",0.2,"not_special_icon","City Center"
"119",119,"Winnipeg","MB","CA","Since 2008, 20% reduction allowed (anywhere in city) if building is mixed-use and we allow developers to double this up with the infill reduction, totaling 40%. Parking is not required in the Downtown zoning district.","Implemented","Reduce Parking Minimums","Citywide","All Uses","Andrew Ross",1,749534,NA,NA,49.8955367,-97.1384584,"WinnipegMBCA","blue","city",1,"not_special_icon","Citywide"
"120",120,"Yorkton","SK","CA","Yorkton exempts parking requirements for small developments in the city center. There is also an in-lieu option to further reduce requirements.","Implemented","Reduce Parking Minimums","City Center/Business District","All Uses","Barbara Dupuis",1,16343,NA,NA,51.212045,-102.461243,"YorktonSKCA","orange","city",0.2,"not_special_icon","City Center"
"121",121,"New York CIty","NY","US","NYC consists of 5 boroughs with over 8 million people. NYC has no parking minimums in most of Manhattan, and reduced requirements (with no requirement for certain types of housing) in several other dense neighborhoods around the city. -Laura Smith","Implemented","Reduce Parking Minimums, Eliminate Parking Minimums","Citywide","All Uses","Laura Smith",0,8336817,NA,NA,40.7127281,-74.0060152,"New York CItyNYUS","blue","city",1,"not_special_icon","Citywide"
"122",122,"Belfast",NA,"GB","There are no parking requirements for the downtown area. The city is also permitted to consider alternative parking plans to reduce off-street parking requirements. These include joint-use parking plans, and reduced or eliminated off-street requirements due to proximity to existing public parking and/or on-street parking. -Ken Whitney","Unverified",NA,NA,NA,"Ken Whitney",0,553230,NA,NA,54.596391,-5.9301829,"BelfastGB","red","car",1,"not_special_icon",NA
"123",123,"Frankfort","KY","US","There are slight reductions available for parking requirements for bike parking and permeable surfaces.","Implemented","Reduce Parking Minimums","Citywide","All Uses","Brent Sweger",1,27755,NA,NA,38.2009055,-84.8732836,"FrankfortKYUS","blue","city",0.2,"not_special_icon","Citywide"
"124",124,"Greenville","SC","US","In 2009-2010, the City of Greenville, SC worked with Upstate Forever, a local non-profit organization that works to promote sensible growth and protect special places in Upstate SC, to conduct a study of some of the City’s off-street parking requirements for commercial properties. The study ultimately showed that there was an excess of available parking (up to 65%) during times of peak use, and as a result, the City revised 10 of its requirements to reflect the actual parking demand. Additionally, the City worked with Upstate Forever to create a fee-in-lieu program that requires developers who install more than the minimum requirement of parking spaces to either pay a fee for each additional space (to be used for stormwater management) or install LID to treat the stormwater runoff created as a result. -Erika Hollis","Unverified",NA,NA,NA,"Erika Hollis",0,70635,NA,NA,34.851354,-82.3984882,"GreenvilleSCUS","red","car",0.2,"not_special_icon",NA
"125",125,"Indianapolis","IN","US",NA,"Unverified",NA,NA,NA,NA,0,876384,NA,NA,39.7683331,-86.1583502,"IndianapolisINUS","red","car",1,"not_special_icon",NA
"126",126,"Petaluma","CA","US",NA,"Unverified",NA,NA,NA,NA,0,60520,NA,NA,38.270022,-122.606122413043,"PetalumaCAUS","red","car",0.2,"not_special_icon",NA
"127",127,"Temecula","CA","US",NA,"Unverified",NA,NA,NA,NA,0,114761,NA,NA,33.4946353,-117.1473661,"TemeculaCAUS","red","car",0.4,"not_special_icon",NA
"128",128,"New Orleans","LA","US","Historic Districts and the Central Business District are exempt from parking minimums. Parking maximums are 150% of the minimums.","Implemented","Parking Maximums","City Center/Business District","Residential","Maggie Kochman",0,390144,NA,NA,29.9499323,-90.0701156,"New OrleansLAUS","orange","home",0.7,"not_special_icon","City Center"
"129",129,"Norwood","MA","US",NA,"Unverified",NA,NA,NA,NA,0,29195,NA,NA,40.7055931,-89.6987129,"NorwoodMAUS","red","car",0.2,"not_special_icon",NA
"130",130,"Joplin","MO","US","Parking requirement reductions were proposed during planning review.","Proposed","Reduce Parking Minimums",NA,NA,"Sam Anselm",0,50925,NA,NA,37.08418,-94.51323,"JoplinMOUS","red","car",0.2,"not_special_icon",NA
"131",131,"Florence","AL","US","No parking is required in the Central Business District or the East Florence Historic District.","Implemented","Eliminate Parking Minimums","City Center/Business District","All Uses","Melissa Bailey",1,40797,NA,NA,34.79981,-87.677251,"FlorenceALUS","orange","city",0.2,"not_special_icon","City Center"
"132",132,"Cleveland","OH","US","No parking minimums in CBD since 1971, still lots of parking lots downtown","Implemented","Eliminate Parking Minimums","City Center/Business District","All Uses",NA,0,381009,NA,NA,41.5051613,-81.6934446,"ClevelandOHUS","orange","city",0.7,"not_special_icon","City Center"
"133",133,"Santa Rosa","CA","US","In Fall 2020, the Santa Rosa City Council adopted a new Downtown Station Area Specific Plan that revised Downtown parking policy to eliminate minimum parking requirements within the Downtown Station Area boundary. This policy was codified and went into effect on January 1, 2021.","Implemented","Eliminate Parking Minimums","City Center/Business District","All Uses","Angel York",0,176753,NA,NA,38.4404925,-122.7141049,"Santa RosaCAUS","orange","city",0.4,"not_special_icon","City Center"
"134",134,"Hartford","CT","US","New form based zoning code with parking maximums city wide.","Implemented","Parking Maximums","Citywide","All Uses",NA,1,122105,NA,NA,41.7655582,-72.6906127614661,"HartfordCTUS","blue","city",0.4,"not_special_icon","Citywide"
"135",135,"Stonington","CT","US","1. Created a special parking overlay district in Pawcatuck, which eliminates the need for off-street parking for existing commercial buildings/uses. This enables change of use. 
2. Parking maximums for certain uses townwide
3. Bicycle parking required for certain uses townwide
4. Commission may allow shared / reduced parking when appropriate","Implemented","Eliminate Parking Minimums","City Center/Business District","Commercial",NA,0,884,NA,NA,41.3359327,-71.9059042,"StoningtonCTUS","orange","building",0.2,"not_special_icon","City Center"
"136",136,"West Palm Beach","FL","US","Reduced Parking minimums with Parking Maximums in CBD and special districts. No parking minimums in Okeechobee Business district with soft and hard parking maximums, if the developer wants to exceed the soft max they have to pay into the transit operations budget. No parking minimum for microunits in CBD.","Implemented","Eliminate Parking Minimums, Parking Maximums, Reduce Parking Minimums","City Center/Business District","Residential, All Uses",NA,0,111955,NA,NA,26.715364,-80.0532942,"West Palm BeachFLUS","orange","city",0.4,"not_special_icon","City Center"
"137",137,"Decatur","GA","US","No additional parking shall be required for a change in use, as allowed within the zoning district, for an existing building or the use of previously unused space within an existing building within the DDPD.","Unverified","Reduce Parking Minimums","City Center/Business District","All Uses",NA,1,25696,NA,NA,34.6240205,-87.0579187281271,"DecaturGAUS","orange","city",0.2,"not_special_icon","City Center"
"138",138,"Marysville","OH","US","This year the City eliminated parking requirements in our Historic Uptown Commercial core district.","Implemented","Eliminate Parking Minimums","City Center/Business District","Commercial, Industrial, Other","Chad Flowers",0,24667,NA,NA,40.2364486,-83.3671432,"MarysvilleOHUS","orange","building",0.2,"not_special_icon","City Center"
"139",139,"Conway","AR","US",NA,"Unverified","Reduce Parking Minimums","Citywide","All Uses",NA,0,66127,NA,NA,35.0886963,-92.4421011,"ConwayARUS","blue","city",0.2,"not_special_icon","Citywide"
