"","city","state","country","report_summary","report_status","report_type","report_magnitude","land_uses","reporter_name","date_of_reform","last_updated","is_verified","is_magnitude_regional","is_magnitude_citywide","is_magnitude_citycenter","is_magnitude_transit","is_magnitude_mainstreet","is_type_eliminated","is_type_reduced","is_type_maximums","is_uses_alluses","is_uses_residential","is_uses_commercial","is_uses_lowdensity","is_uses_multifamily","is_no_mandate_city","population","is_notable","is_recent","citation_url","lat","long","id","magnitude_encoded","border_encoded","land_use_encoded","population_encoded","city_search","is_special"
"285","Butler","IN","US","Off-street parking spaces are not required for business uses in the Butler Historic District.","Implemented","Eliminate Parking Minimums","City Center/Business District","Commercial","Samuel Deetz","","March 30, 2023 at 10:13:12 PM PDT",0,0,0,1,0,0,1,0,0,0,0,1,0,0,0,2635,"false","false","https://parkingreform.org/mandates-map/city_detail/Butler_IN.html",41.4297694,-84.8713507,"ButlerINUS","City Center","City Center","building",0.2,"Butler, IN","not_special_icon"
"286","Clearwater","KS","US","The C-1 commercial district is exempt from minimum parking requirements.","Implemented","Eliminate Parking Minimums","City Center/Business District","All Uses","Samuel Deetz","","March 29, 2023 at 2:01:48 PM PDT",0,0,0,1,0,0,1,0,0,1,0,0,0,0,0,2653,"false","false","https://parkingreform.org/mandates-map/city_detail/Clearwater_KS.html",37.5027959,-97.5044921,"ClearwaterKSUS","City Center","City Center All","city",0.2,"Clearwater, KS","not_special_icon"
"287","Juneau","WI","US","The B-2 central business district is exempt from minimum parking requirements.","Implemented","Eliminate Parking Minimums","City Center/Business District","All Uses","Samuel Deetz","","March 27, 2023 at 5:19:38 PM PDT",1,0,0,1,0,0,1,0,0,1,0,0,0,0,0,2658,"false","false","https://parkingreform.org/mandates-map/city_detail/Juneau_WI.html",43.4055504,-88.7051037,"JuneauWIUS","City Center","City Center All","city",0.2,"Juneau, WI","not_special_icon"
"288","Eldora","IA","US","The C-2 Commercial District is exempt from minimum parking requirements.","Implemented","Eliminate Parking Minimums","City Center/Business District","All Uses","Samuel Deetz","","March 15, 2023 at 1:30:47 PM PDT",0,0,0,1,0,0,1,0,0,1,0,0,0,0,0,2663,"false","false","https://parkingreform.org/mandates-map/city_detail/Eldora_IA.html",42.3606883,-93.099609,"EldoraIAUS","City Center","City Center All","city",0.2,"Eldora, IA","not_special_icon"
"289","Bloomfield","IA","US","The C-2 District is exempt from minimum parking requirements.","Implemented","Eliminate Parking Minimums","City Center/Business District","All Uses","Samuel Deetz","","March 14, 2023 at 2:27:55 PM PDT",0,0,0,1,0,0,1,0,0,1,0,0,0,0,0,2682,"false","false","https://parkingreform.org/mandates-map/city_detail/Bloomfield_IA.html",40.7510398,-92.4143872,"BloomfieldIAUS","City Center","City Center All","city",0.2,"Bloomfield, IA","not_special_icon"
"290","Cohasset","MN","US","Uses within the Cohasset Industrial Park (CIP) district are exempt from minimum parking requirements.","Implemented","Eliminate Parking Minimums","Main Street/Special","Industrial","Samuel Deetz","","April 3, 2023 at 7:29:50 PM PDT",0,0,0,0,0,1,1,0,0,0,0,0,0,0,0,2689,"false","false","https://parkingreform.org/mandates-map/city_detail/Cohasset_MN.html",47.263556,-93.620215,"CohassetMNUS","Main Street","Main Street All","car",0.2,"Cohasset, MN","not_special_icon"
"291","Christopher","IL","US","The B-2 Primary Business District is exempt from minimum parking requirements.","Implemented","Eliminate Parking Minimums","City Center/Business District","All Uses","Samuel Deetz","","March 27, 2023 at 5:07:41 PM PDT",1,0,0,1,0,0,1,0,0,1,0,0,0,0,0,2697,"false","false","https://parkingreform.org/mandates-map/city_detail/Christopher_IL.html",37.9725501,-89.053408,"ChristopherILUS","City Center","City Center All","city",0.2,"Christopher, IL","not_special_icon"
"292","Savanna","IL","US","The B-1 Retail Business district is exempt from parking requirements for all uses. ","Implemented","Eliminate Parking Minimums","City Center/Business District","All Uses","Samuel Deetz","Apr 6, 2022","February 13, 2023 at 1:46:27 PM PST",1,0,0,1,0,0,1,0,0,1,0,0,0,0,0,2699,"false","false","https://parkingreform.org/mandates-map/city_detail/Savanna_IL.html",42.0944672,-90.1567944,"SavannaILUS","City Center","City Center All","city",0.2,"Savanna, IL","not_special_icon"
"293","Hawarden","IA","US","The “B-2” Commercial District is exempt from minimum parking requirements.","Implemented","Eliminate Parking Minimums","City Center/Business District","All Uses","Samuel Deetz","","April 10, 2023 at 8:47:07 PM PDT",0,0,0,1,0,0,1,0,0,1,0,0,0,0,0,2700,"false","false","https://parkingreform.org/mandates-map/city_detail/Hawarden_IA.html",42.9956607,-96.485317,"HawardenIAUS","City Center","City Center All","city",0.2,"Hawarden, IA","not_special_icon"
"294","Foley","MN","US","The “B-1"" Central Business District is exempt from minimum parking requirements.","Implemented","Eliminate Parking Minimums","City Center/Business District","All Uses","Samuel Deetz","","March 21, 2023 at 9:35:40 PM PDT",0,0,0,1,0,0,1,0,0,1,0,0,0,0,0,2711,"false","false","https://parkingreform.org/mandates-map/city_detail/Foley_MN.html",45.663512,-93.9137277,"FoleyMNUS","City Center","City Center All","city",0.2,"Foley, MN","not_special_icon"
"295","Hillsboro","KS","US","Minimum parking requirements do not apply in the “C – 1” Commercial District.","Implemented","Eliminate Parking Minimums","City Center/Business District","All Uses","Samuel Deetz","","April 6, 2023 at 8:38:43 PM PDT",0,0,0,1,0,0,1,0,0,1,0,0,0,0,0,2732,"false","false","https://parkingreform.org/mandates-map/city_detail/Hillsboro_KS.html",38.3533075,-97.2047316,"HillsboroKSUS","City Center","City Center All","city",0.2,"Hillsboro, KS","not_special_icon"
"296","Granite Falls","MN","US","The C-2 Downtown Commerce District is exempt from minimum parking requirements.","Implemented","Eliminate Parking Minimums","City Center/Business District","All Uses","Samuel Deetz","","March 27, 2023 at 6:21:08 PM PDT",0,0,0,1,0,0,1,0,0,1,0,0,0,0,0,2737,"false","false","https://parkingreform.org/mandates-map/city_detail/GraniteFalls_MN.html",44.8099575,-95.5455752,"Granite FallsMNUS","City Center","City Center All","city",0.2,"Granite Falls, MN","not_special_icon"
"297","Roseau","MN","US","All commercial uses are exempt from minimum parking requirements.","Implemented","Eliminate Parking Minimums","Citywide","Commercial","Samuel Deetz","","March 27, 2023 at 5:22:43 PM PDT",1,0,1,0,0,0,1,0,0,0,0,1,0,0,0,2744,"false","false","https://parkingreform.org/mandates-map/city_detail/Roseau_MN.html",48.8457996,-95.7613231,"RoseauMNUS","Citywide","Citywide","building",0.2,"Roseau, MN","not_special_icon"
"298","Barnesville","MN","US","The C-1 Central Business District is exempt from off-street parking and loading regulations.","Implemented","Eliminate Parking Minimums","City Center/Business District","All Uses","Samuel Deetz","","April 4, 2023 at 10:09:19 AM PDT",0,0,0,1,0,0,1,0,0,1,0,0,0,0,0,2759,"false","false","https://parkingreform.org/mandates-map/city_detail/Barnesville_MN.html",46.652182,-96.41979,"BarnesvilleMNUS","City Center","City Center All","city",0.2,"Barnesville, MN","not_special_icon"
"299","Galena","KS","US","The C-1 Retail Business District is exempt from minimum parking requirements.","Implemented","Eliminate Parking Minimums","City Center/Business District","All Uses","Samuel Deetz","","April 6, 2023 at 9:26:40 PM PDT",0,0,0,1,0,0,1,0,0,1,0,0,0,0,0,2761,"false","false","https://parkingreform.org/mandates-map/city_detail/Galena_KS.html",37.0741519,-94.6390414,"GalenaKSUS","City Center","City Center All","city",0.2,"Galena, KS","not_special_icon"
"300","Albany","MN","US","The C-1 Core Commercial District is exempt from minimum parking requirements.","Implemented","Eliminate Parking Minimums","City Center/Business District","All Uses","Samuel Deetz","","April 4, 2023 at 3:33:18 PM PDT",0,0,0,1,0,0,1,0,0,1,0,0,0,0,0,2780,"false","false","https://parkingreform.org/mandates-map/city_detail/Albany_MN.html",45.6299647,-94.5700048,"AlbanyMNUS","City Center","City Center All","city",0.2,"Albany, MN","not_special_icon"
"301","Heyworth","IL","US","When the application of the off street parking regulations results in a requirement of not more than three (3) parking spaces for any commercial or business use, those parking spaces are not required. However, where two (2) or more uses are located on a single lot, only one of those uses may be eligible for the exemption. In no instances may the exemption apply to dwelling units.","Implemented","Eliminate Parking Minimums","Citywide","Commercial, Industrial","Samuel Deetz","","April 11, 2023 at 4:07:58 PM PDT",0,0,1,0,0,0,1,0,0,0,0,1,0,0,0,2791,"false","false","https://parkingreform.org/mandates-map/city_detail/Heyworth_IL.html",40.313378,-88.9736633,"HeyworthILUS","Citywide","Citywide","building",0.2,"Heyworth, IL","not_special_icon"
"302","Grundy Center","IA","US","There are no off-street parking requirements in the “C-1” Central Commercial District.","Implemented","Eliminate Parking Minimums","City Center/Business District","All Uses","Samuel Deetz","","March 15, 2023 at 9:36:40 AM PDT",0,0,0,1,0,0,1,0,0,1,0,0,0,0,0,2796,"false","false","https://parkingreform.org/mandates-map/city_detail/GrundyCenter_IA.html",42.3616501,-92.7685327,"Grundy CenterIAUS","City Center","City Center All","city",0.2,"Grundy Center, IA","not_special_icon"
"303","Cokato","MN","US","Commercial uses within the C-1 Central Business District are exempt from minimum parking requirements.","Implemented","Eliminate Parking Minimums","City Center/Business District","Commercial","Samuel Deetz","","April 4, 2023 at 2:00:19 PM PDT",0,0,0,1,0,0,1,0,0,0,0,1,0,0,0,2799,"false","false","https://parkingreform.org/mandates-map/city_detail/Cokato_MN.html",45.075043,-94.1903675,"CokatoMNUS","City Center","City Center","building",0.2,"Cokato, MN","not_special_icon"
"304","Clarion","IA","US","The Central Commercial (C-1) District is exempt from minimum parking requirements.","Implemented","Eliminate Parking Minimums","City Center/Business District","All Uses","Samuel Deetz","","March 20, 2023 at 5:01:40 PM PDT",0,0,0,1,0,0,1,0,0,1,0,0,0,0,0,2810,"false","false","https://parkingreform.org/mandates-map/city_detail/Clarion_IA.html",42.7317899,-93.7321871,"ClarionIAUS","City Center","City Center All","city",0.2,"Clarion, IA","not_special_icon"
"305","Montgomery City","MO","US","No off-street parking is required in the B-2 Central Business District.","Implemented","Eliminate Parking Minimums","City Center/Business District","All Uses","Samuel Deetz","","March 18, 2023 at 9:49:40 AM PDT",0,0,0,1,0,0,1,0,0,1,0,0,0,0,0,2811,"false","false","https://parkingreform.org/mandates-map/city_detail/MontgomeryCity_MO.html",38.9775406,-91.5048844,"Montgomery CityMOUS","City Center","City Center All","city",0.2,"Montgomery City, MO","not_special_icon"
"306","Davis","OK","US","In the C-3 general commercial district, only employee parking is required.","Implemented","Eliminate Parking Minimums, Reduce Parking Minimums","City Center/Business District","Residential, Commercial","Samuel Deetz","","April 8, 2023 at 2:45:26 PM PDT",0,0,0,1,0,0,1,1,0,0,1,1,0,0,0,2823,"false","false","https://parkingreform.org/mandates-map/city_detail/Davis_OK.html",34.5034796,-97.1188924,"DavisOKUS","City Center","City Center","laptop",0.2,"Davis, OK","not_special_icon"
"307","Fairfax","IA","US","No off-street parking is required in the C1 Central Business District Commercial.","Implemented","Eliminate Parking Minimums","City Center/Business District","All Uses","Samuel Deetz","","April 14, 2023 at 7:14:35 PM PDT",0,0,0,1,0,0,1,0,0,1,0,0,0,0,0,2828,"false","false","https://parkingreform.org/mandates-map/city_detail/Fairfax_IA.html",41.9194471,-91.7810132,"FairfaxIAUS","City Center","City Center All","city",0.2,"Fairfax, IA","not_special_icon"
"308","Ketchum","ID","US","In the community core and tourist zone, residential units under 750 square feet are exempt from providing any parking. Community housing, restaurants and food service, the first 5,500 sf of retail use, the first 5,500 square feet of assembly use (theaters, conference centers etc.), are exempt from providing any parking in the community core and tourist zone.","Implemented","Eliminate Parking Minimums","City Center/Business District","Low Density (SF) Residential, Commercial","Michael David","","June 28, 2022 at 11:23:46 AM PDT",1,0,0,1,0,0,1,0,0,0,1,1,0,0,0,2855,"","","https://parkingreform.org/mandates-map/city_detail/Ketchum_ID.html",43.680741,-114.363662,"KetchumIDUS","City Center","City Center","laptop",0.2,"Ketchum, ID","not_special_icon"
"309","Rogers City","MI","US","Rogers City has implemented the removal of parking minimum standards for the B-2 district, the downtown area. This is primarily commercial and mixed use with a couple of residential lots.","Implemented","Eliminate Parking Minimums","City Center/Business District","Commercial, Industrial, Residential","Alex Harimoto","","April 11, 2023 at 2:18:39 PM PDT",1,0,0,1,0,0,1,0,0,0,1,1,0,0,0,2886,"false","false","https://parkingreform.org/mandates-map/city_detail/RogersCity_MI.html",45.421391,-83.818185,"Rogers CityMIUS","City Center","City Center","laptop",0.2,"Rogers City, MI","not_special_icon"
"310","Arcola","IL","US","No off-street parking is required in the B-1 General Commercial District.","Implemented","Eliminate Parking Minimums","City Center/Business District","All Uses","Samuel Deetz","","April 3, 2023 at 9:26:08 PM PDT",0,0,0,1,0,0,1,0,0,1,0,0,0,0,0,2927,"false","false","https://parkingreform.org/mandates-map/city_detail/Arcola_IL.html",39.684755,-88.3064367,"ArcolaILUS","City Center","City Center All","city",0.2,"Arcola, IL","not_special_icon"
"311","Wisconsin Dells","WI","US","Parking requirements do not apply to the C-2 Downtown Commercial zoning district.  In addition, the number of parking spaces provided in a ground surface parking lot may not exceed the minimum number by more than 20 percent.","Implemented","Eliminate Parking Minimums, Parking Maximums","City Center/Business District","All Uses","Samuel Deetz","","March 22, 2023 at 10:31:13 PM PDT",1,0,0,1,0,0,1,0,1,1,0,0,0,0,0,2942,"false","false","https://parkingreform.org/mandates-map/city_detail/WisconsinDells_WI.html",43.6256168,-89.7715646,"Wisconsin DellsWIUS","City Center","City Center All","city",0.2,"Wisconsin Dells, WI","not_special_icon"
"312","Summerset","SD","US","For commercial uses, excluding new and used vehicle sales, maximum parking limits are set at 20% above the minimum requirements.","Implemented","Parking Maximums","Citywide","Commercial","Samuel Deetz","","April 1, 2023 at 4:00:20 PM PDT",0,0,1,0,0,0,0,0,1,0,0,1,0,0,0,2972,"false","false","https://parkingreform.org/mandates-map/city_detail/Summerset_SD.html",44.1787783,-103.3341079,"SummersetSDUS","Citywide","Citywide","building",0.2,"Summerset, SD","not_special_icon"
"313","Provincetown","MA","US","In the Town Center Commercial (TCC) non-residential uses are exempt from parking requirements.","Implemented","Eliminate Parking Minimums","City Center/Business District","Commercial","","","May 24, 2022 at 3:11:33 PM PDT",1,0,0,1,0,0,1,0,0,0,0,1,0,0,0,2994,"","","https://parkingreform.org/mandates-map/city_detail/Provincetown_MA.html",42.058436,-70.1786375,"ProvincetownMAUS","City Center","City Center","building",0.2,"Provincetown, MA","not_special_icon"
"314","David City","NE","US","The off-street parking requirements do not apply to uses within the C-2 Downtown Commercial District.","Implemented","Eliminate Parking Minimums","City Center/Business District","All Uses","Samuel Deetz","","March 15, 2023 at 6:03:13 PM PDT",0,0,0,1,0,0,1,0,0,1,0,0,0,0,0,2995,"false","false","https://parkingreform.org/mandates-map/city_detail/DavidCity_NE.html",41.2527355,-97.1300668,"David CityNEUS","City Center","City Center All","city",0.2,"David City, NE","not_special_icon"
"315","Chatfield","MN","US","Allowed uses in the B-1 General Commercial District are exempt from minimum parking requirements.","Implemented","Eliminate Parking Minimums","City Center/Business District","All Uses","Samuel Deetz","","March 27, 2023 at 5:11:39 PM PDT",1,0,0,1,0,0,1,0,0,1,0,0,0,0,0,2997,"false","false","https://parkingreform.org/mandates-map/city_detail/Chatfield_MN.html",43.8446296,-92.1880907,"ChatfieldMNUS","City Center","City Center All","city",0.2,"Chatfield, MN","not_special_icon"
"316","Iron River","MI","US","Buildings and uses located within the CBD are exempt from providing off-street parking.","Implemented","Eliminate Parking Minimums","City Center/Business District","All Uses","Samuel Deetz","","March 27, 2023 at 5:05:29 PM PDT",1,0,0,1,0,0,1,0,0,1,0,0,0,0,0,3007,"false","false","https://parkingreform.org/mandates-map/city_detail/IronRiver_MI.html",46.092732,-88.642355,"Iron RiverMIUS","City Center","City Center All","city",0.2,"Iron River, MI","not_special_icon"
"317","Somerset","WI","US","The C-1 Business District is exempt from minimum parking requirements.","Implemented","Eliminate Parking Minimums","City Center/Business District","All Uses","Samuel Deetz","","March 17, 2023 at 9:48:03 PM PDT",0,0,0,1,0,0,1,0,0,1,0,0,0,0,0,3019,"false","false","https://parkingreform.org/mandates-map/city_detail/Somerset_WI.html",45.1244108,-92.6735365,"SomersetWIUS","City Center","City Center All","city",0.2,"Somerset, WI","not_special_icon"
"318","Valley","NE","US","Minimum parking requirements do not apply to the C-2 Central Business District.","Implemented","Eliminate Parking Minimums","City Center/Business District","All Uses","Samuel Deetz","","April 6, 2023 at 3:33:46 PM PDT",0,0,0,1,0,0,1,0,0,1,0,0,0,0,0,3037,"false","false","https://parkingreform.org/mandates-map/city_detail/Valley_NE.html",41.312758,-96.3459776,"ValleyNEUS","City Center","City Center All","city",0.2,"Valley, NE","not_special_icon"
"319","Chaffee","MO","US","The ""C-3"" Central Business District is exempt from minimum parking requirements.","Implemented","Eliminate Parking Minimums","City Center/Business District","All Uses","Samuel Deetz","","April 16, 2023 at 8:30:16 AM PDT",0,0,0,1,0,0,1,0,0,1,0,0,0,0,0,3057,"false","false","https://parkingreform.org/mandates-map/city_detail/Chaffee_MO.html",37.1800513,-89.6550896,"ChaffeeMOUS","City Center","City Center All","city",0.2,"Chaffee, MO","not_special_icon"
"320","Canton","SD","US","Minimum parking requirements are not applicable to property in the CB Central Business District, except for residential uses which are authorized by a conditional use permit. ","Implemented","Eliminate Parking Minimums","City Center/Business District","Commercial","Samuel Deetz","","April 3, 2023 at 4:14:35 PM PDT",0,0,0,1,0,0,1,0,0,0,0,1,0,0,0,3066,"false","false","https://parkingreform.org/mandates-map/city_detail/Canton_SD.html",32.555664,-95.8640507,"CantonSDUS","City Center","City Center","building",0.2,"Canton, SD","not_special_icon"
"321","Ellsworth","KS","US","The C-1 commercial district is exempt from minimum parking requirements.","Implemented","Eliminate Parking Minimums","City Center/Business District","All Uses","Samuel Deetz","","April 6, 2023 at 1:40:55 PM PDT",0,0,0,1,0,0,1,0,0,1,0,0,0,0,0,3066,"false","false","https://parkingreform.org/mandates-map/city_detail/Ellsworth_KS.html",38.7305648,-98.2281126,"EllsworthKSUS","City Center","City Center All","city",0.2,"Ellsworth, KS","not_special_icon"
"322","Vivian","LA","US","Uses within the B-3 Central Community Business District are exempt from minimum parking requirements.","Implemented","Eliminate Parking Minimums","City Center/Business District","All Uses","Samuel Deetz","","April 2, 2023 at 8:42:14 PM PDT",0,0,0,1,0,0,1,0,0,1,0,0,0,0,0,3073,"false","false","https://parkingreform.org/mandates-map/city_detail/Vivian_LA.html",35.2898216,-95.7163801,"VivianLAUS","City Center","City Center All","city",0.2,"Vivian, LA","not_special_icon"
"323","Chattahoochee Hills","GA","US","No car parking mandates, maximums for retail, multi-family, and other uses.","Implemented","Eliminate Parking Minimums, Parking Maximums","Citywide","All Uses","Thomas Reed","","January 25, 2023 at 1:59:39 PM PST",0,0,1,0,0,0,1,0,1,1,0,0,0,0,1,3084,"false","false","https://parkingreform.org/mandates-map/city_detail/ChattahoocheeHills_GA.html",33.5790874,-84.7686732,"Chattahoochee HillsGAUS","Citywide","Citywide All","city",0.2,"Chattahoochee Hills, GA","not_special_icon"
"324","Minden","NE","US","Public, semipublic, business and commercial uses are exempt from minimum parking requirements in the following area: all of block 20; lots 1 through 6, inclusive, block 13; lots 1, 2, 3, 10, and lots 1 through 5, inclusive, of the subdivision of lots 11 and 12, block 19; lots 7 through 12 inclusive, block 29, lots 4, 5, 6 and lots 1 through 5, inclusive of the subdivision of lots 7, 8 and 9, and the east 24 feet of lots 7, 8 and 9, block 21; all in the original town, now city.","Implemented","Eliminate Parking Minimums","City Center/Business District","Commercial, Medical, Other","Samuel Deetz","","March 17, 2023 at 2:03:25 PM PDT",0,0,0,1,0,0,1,0,0,0,0,1,0,0,0,3118,"false","false","https://parkingreform.org/mandates-map/city_detail/Minden_NE.html",40.4985164,-98.9476854,"MindenNEUS","City Center","City Center","building",0.2,"Minden, NE","not_special_icon"
"325","Pine City","MN","US","The CBD Central Business District is exempt from minimum parking requirements, except for dwelling, lodging and day care uses.","Implemented","Eliminate Parking Minimums","City Center/Business District","Commercial","Samuel Deetz","","April 3, 2023 at 7:35:50 PM PDT",0,0,0,1,0,0,1,0,0,0,0,1,0,0,0,3130,"false","false","https://parkingreform.org/mandates-map/city_detail/PineCity_MN.html",45.8260672,-92.9685423,"Pine CityMNUS","City Center","City Center","building",0.2,"Pine City, MN","not_special_icon"
"326","Tipton","IA","US","The C-2 General Business District is exempt from minimum parking requirements.","Implemented","Eliminate Parking Minimums","City Center/Business District","All Uses","Samuel Deetz","","April 1, 2023 at 8:59:29 PM PDT",0,0,0,1,0,0,1,0,0,1,0,0,0,0,0,3149,"false","false","https://parkingreform.org/mandates-map/city_detail/Tipton_IA.html",41.7697016,-91.1281732,"TiptonIAUS","City Center","City Center All","city",0.2,"Tipton, IA","not_special_icon"
"327","Galena","IL","US","There are no parking requirements in the Downtown Core zone. ","Implemented","Eliminate Parking Minimums","City Center/Business District","All Uses","Jake Schreiner","","August 17, 2022 at 12:12:26 PM PDT",1,0,0,1,0,0,1,0,0,1,0,0,0,0,0,3168,"false","false","https://parkingreform.org/mandates-map/city_detail/Galena_IL.html",42.4157304,-90.4294726,"GalenaILUS","City Center","City Center All","city",0.2,"Galena, IL","not_special_icon"
"328","Shelby","MT","US","No off street parking and loading spaces are required in the Central Business District.","Implemented","Eliminate Parking Minimums","City Center/Business District","All Uses","Samuel Deetz","","April 1, 2023 at 3:14:22 PM PDT",0,0,0,1,0,0,1,0,0,1,0,0,0,0,0,3169,"false","false","https://parkingreform.org/mandates-map/city_detail/Shelby_MT.html",48.5054997,-111.856872,"ShelbyMTUS","City Center","City Center All","city",0.2,"Shelby, MT","not_special_icon"
"329","Burlington","CO","US","The C-1 downtown commercial district is exempt from minimum parking requirements.","Implemented","Eliminate Parking Minimums","City Center/Business District","All Uses","Samuel Deetz","","April 1, 2023 at 9:47:54 AM PDT",0,0,0,1,0,0,1,0,0,1,0,0,0,0,0,3172,"false","false","https://parkingreform.org/mandates-map/city_detail/Burlington_CO.html",44.4761601,-73.212906,"BurlingtonCOUS","City Center","City Center All","city",0.2,"Burlington, CO","not_special_icon"
"330","Lodi","WI","US","No accessory off-street parking is required in the C-2 Central Business District, except for dwelling units located above the ground floor of permitted uses.","Implemented","Eliminate Parking Minimums","City Center/Business District","Commercial","Samuel Deetz","","March 16, 2023 at 12:48:24 PM PDT",0,0,0,1,0,0,1,0,0,0,0,1,0,0,0,3189,"false","false","https://parkingreform.org/mandates-map/city_detail/Lodi_WI.html",43.313878,-89.5265093,"LodiWIUS","City Center","City Center","building",0.2,"Lodi, WI","not_special_icon"
"331","West Burlington","IA","US","Minimum parking requirements do not apply to any uses in the B-1 Limited Retail Business District.","Implemented","Eliminate Parking Minimums","City Center/Business District","All Uses","Samuel Deetz","","April 13, 2023 at 7:06:01 PM PDT",0,0,0,1,0,0,1,0,0,1,0,0,0,0,0,3197,"false","false","https://parkingreform.org/mandates-map/city_detail/WestBurlington_IA.html",40.825083,-91.1565496,"West BurlingtonIAUS","City Center","City Center All","city",0.2,"West Burlington, IA","not_special_icon"
"332","Carlyle","IL","US","Minimum Parking Requirements are not applicable to ""B-1"" Business Districts.","Implemented","Eliminate Parking Minimums","City Center/Business District","Commercial","Samuel Deetz","","March 27, 2023 at 5:19:39 PM PDT",1,0,0,1,0,0,1,0,0,0,0,1,0,0,0,3222,"false","false","https://parkingreform.org/mandates-map/city_detail/Carlyle_IL.html",38.6103264,-89.3725796,"CarlyleILUS","City Center","City Center","building",0.2,"Carlyle, IL","not_special_icon"
